reviews,lemmas,ufeat,aspectCategory
The space is nice but when we order our drink we were in for a surprise.,"['space', 'nice', 'surpris', 'drink', 'order']","['drink order', 'space is', 'we were', 'we order']",anecdotes/miscellaneous
The entire place and the treatment we received felt as a conveyor belt.,"['belt', 'place', 'receiv', 'entir', 'felt', 'treatment', 'conveyor']","['entire place', 'place felt', 'we received']",service
Joe's Pizza used to have the best slice until this pizzeria opened up.,"['best', 'use', 'joe', 'open', 'slice', 'pizza', 'pizzeria']","['slice have', 'best slice', 'pizza used', 'pizzeria opened']",anecdotes/miscellaneous
I in all reality felt as if I had just gotten off Air France and was in the 8th District in Paris.,"['district', 'air', 'pari', 'get', 'franc', 'th', 'realiti', 'felt']","['i gotten', '8th district', 'just gotten', 'france gotten', 'i felt']",ambience
I have never had anything like it!,"['anyth', 'like', 'never']","['had anything', 'anything had', 'never had', 'i had']",anecdotes/miscellaneous
"Yeah the crowd can take it a bit seriously, but it shouldn't.","['yeah', 'take', 'bite', 'serious', 'crowd']","['crowd take', 'it take', 'it should', ""n't should""]",anecdotes/miscellaneous
And they provided a delicious dessert on the house!,"['dessert', 'delici', 'hous', 'provid']","['dessert provided', 'delicious dessert', 'they provided']",food
"They are still living in the dark ages and do not have an answering machine, so if you want to make a reservation you are limited.","['make', 'reserv', 'answer', 'machin', 'limit', 'dark', 'want', 'age', 'live', 'still']","['you are', 'reservation make', 'still living', 'dark ages', 'answering machine', 'you want', 'machine have', 'not have', 'they living']",service
"The food is amazing, rich pastas and fresh doughy pizza.","['fresh', 'pasta', 'doughi', 'food', 'amaz', 'rich', 'pizza']","['food is', 'doughy pizza', 'rich pastas', 'fresh pizza', 'fresh doughy']",food
"Food was very good, but not what I would consider out of this world.","['good', 'consid', 'world', 'food', 'would']","['very good', 'what consider', 'i consider', 'food was', 'not consider']",food
I had Lobster Bisque it has 2 oz. of Maine Lobster in it.,"['lobster', 'oz', 'main', 'bisqu']","['it has', 'bisque had', 'i had', 'oz has']",food
"I am Indian, and I have tried many Indian places in NY.","['place', 'ny', 'tri', 'indian', 'mani']","['i tried', 'many indian', 'indian places', 'many places', 'i am', 'places tried']",anecdotes/miscellaneous
"Try the Pad Thai, it's fabulous and their prices are so cheap!","['thai', 'tri', 'price', 'pad', 'fabul', 'cheap']","['thai try', 'so cheap', 'prices are', ""it 's""]",food
"On a recent Saturday night, I was with a group of 5 at the Bread Bar.","['group', 'saturday', 'bread', 'recent', 'night', 'bar']","['recent saturday', 'bread bar', 'recent night', 'i was']",anecdotes/miscellaneous
Food is great and inexpensive.,"['food', 'great', 'inexpens']",['food is'],food
The price very reasonable.,"['price', 'reason']","['very reasonable', 'price reasonable']",price
"Dessert - can't be missed, so save room!!!","['room', 'dessert', 'save', 'miss']","['save room', ""n't be"", 'dessert missed', 'so save', ""n't missed"", 'room save']",food
"It can be a little confusing as to where one goes to order, but once the food is ordered, you are in for a treat.","['littl', 'one', 'confus', 'go', 'food', 'treat', 'order']","['you are', 'food ordered', 'it be', 'little confusing', 'one goes']",food
"Take a good sense of humor,an American express card with no limit, walk out with a lollipop,gift bag in hand and enough marketing materials for alain to to take the show on the road","['humor', 'good', 'gift', 'take', 'bag', 'enough', 'express', 'card', 'limit', 'sens', 'walk', 'show', 'market', 'lollipop', 'alain', 'road', 'materi', 'american', 'hand']","['show take', 'american card', 'enough materials', 'american express', 'enough marketing', 'good sense', 'sense take', 'card walk']",price
Ingredients are organic which is a real plus for me.,"['ingredi', 'real', 'organ', 'plu']","['real plus', 'ingredients are', 'which is']",food
It was so bad I actually refused to pay for my food.,"['food', 'bad', 'actual', 'pay', 'refus']","['it was', 'bad i', 'actually refused', 'so bad', 'i refused']",anecdotes/miscellaneous
I recommend this spot to anyone who enjoys  fine cuisine at reasonable prices.,"['anyon', 'reason', 'recommend', 'cuisin', 'enjoy', 'spot', 'price', 'fine']","['fine cuisine', 'reasonable prices', 'who enjoys', 'i recommend', 'spot recommend', 'cuisine enjoys']",anecdotes/miscellaneous
"This is, by far, my favorite restaurant in NYC and I only wish it were more affordable so I could go more often!","['afford', 'could', 'go', 'restaur', 'wish', 'far', 'nyc', 'favorit', 'often']","['more often', 'more affordable', 'only wish', 'it were', 'i go', 'i wish', 'this is', 'favorite restaurant']",anecdotes/miscellaneous
"The staff was very attentive, the ambience lovely, and the food superb.","['ambienc', 'superb', 'attent', 'staff', 'love', 'food']","['staff was', 'ambience lovely', 'very attentive']",food
"I love when restaurants think using fancy expensive ingrediants makes the food fine cuisine, even with no idea how to use them.","['make', 'think', 'love', 'use', 'expens', 'restaur', 'cuisin', 'fanci', 'ingredi', 'idea', 'food', 'even', 'fine']","['cuisine makes', 'fancy expensive', 'expensive ingrediants', 'restaurants think', 'fine cuisine', 'them use', 'using fancy', 'fancy ingrediants', 'food fine', 'i love', 'ingrediants using']",food
THe Pizza and wine were excellent-the service too--but what really MADE this place was the backyard dining area.,"['area', 'place', 'make', 'realli', 'wine', 'servic', 'excel', 'backyard', 'pizza', 'din']","['what made', 'place was', 'pizza were', 'really made', 'excellent-the service', 'dining area']",food
THE FRANKENSTEIN SHOW WAS THE BEST.,"['frankenstein', 'best', 'show']",['show was'],anecdotes/miscellaneous
"The waiters are sweet, the food is tasty and the bill is never too large.","['tasti', 'sweet', 'never', 'waiter', 'bill', 'larg', 'food']","['food is', 'never too', 'bill is', 'waiters are', 'never is', 'too large']",food
"As a fan of Thai, I have tried quite a few different restaurants in NYC and this one was definitely the worst.","['thai', 'worst', 'one', 'fan', 'tri', 'restaur', 'quit', 'differ', 'nyc', 'definit']","['few different', 'i tried', 'one was', 'different restaurants', 'restaurants tried']",anecdotes/miscellaneous
"The service was superb, they treat you like family.","['superb', 'famili', 'servic', 'like', 'treat']","['they treat', 'you treat', 'service was']",service
"We all had the tasting menu and unlike some of the other reviews, I felt there was more than enough food.","['enough', 'review', 'menu', 'tast', 'unlik', 'felt', 'food']","['other reviews', 'we had', 'menu had', 'enough food', 'i felt']",anecdotes/miscellaneous
"It only took about five or so minutes to get an empty table, but standing up wasn't too bad.","['stand', 'minut', 'take', 'get', 'tabl', 'bad', 'empti', 'five']","[""n't was"", 'it took', 'empty table', 'only took', 'table get', ""n't too"", 'minutes took', 'too bad']",service
"The menu may be small, but everything on it is delicious.","['small', 'delici', 'may', 'everyth', 'menu']","['', 'everything is']",food
Too bad Latin Quarters closed.,"['close', 'bad', 'quarter', 'latin']","['bad quarters', 'bad latin', 'latin quarters', 'quarters closed', 'too bad']",anecdotes/miscellaneous
They had scrapped the bottom of the vessel in which they make the rice -RESULT - WE HAD LARGE CHUNKS OF BURNT RICE IN OUR SERVING BOWL.,"['scrap', 'make', 'burn', 'rice', 'larg', 'result', 'bowl', 'serv', 'bottom', 'chunk', 'vessel']","['serving bowl', 'bottom scrapped', 'they scrapped', 'we had', 'they make', 'burnt rice', 'rice make', 'chunks had', 'large chunks']",food
It was divine melts in your mouth.,"['mouth', 'melt', 'divin']","['divine melts', 'it was']",food
Stumbled upon this gem of a pizza place and I will be going back frequently.,"['gem', 'place', 'go', 'stumbl', 'upon', 'frequent', 'back', 'pizza']","['pizza place', 'back frequently', 'i going']",anecdotes/miscellaneous
I live a block away and go to Patsy's frequently.,"['frequent', 'patsi', 'block', 'go', 'away', 'live']",['i live'],anecdotes/miscellaneous
"- for dessert we split chocolate cake and vanilla gelato (with espresso), which were tasty, but I thought a bit overpriced.","['split', 'dessert', 'gelato', 'tasti', 'cake', 'think', 'vanilla', 'bite', 'espresso', 'chocol', 'overpric']","['chocolate cake', 'i thought', 'cake split', 'bit overpriced', 'we split', 'which were']",food
"When I visited my friend who lives in the Upper Eastside, she recommended that we go to this restaurant.","['visit', 'recommend', 'eastsid', 'go', 'restaur', 'live', 'friend', 'upper']","['we go', 'i visited', 'she recommended', 'who lives', 'friend visited', 'upper eastside']",anecdotes/miscellaneous
"Warm, comfortable surroundings, nice appointments (witness the etched glass and brickwork separating the dining rooms).","['room', 'separ', 'appoint', 'brickwork', 'comfort', 'wit', 'nice', 'glass', 'etch', 'surround', 'warm', 'din']","['rooms separating', 'surroundings witness', 'warm surroundings', 'nice appointments', 'etched glass', 'glass separating', 'comfortable surroundings']",ambience
We ran a little late for the reservation but it wasn't a problem to get our table immediately.,"['littl', 'problem', 'get', 'late', 'reserv', 'tabl', 'immedi', 'run']","['', ""n't was"", 'it was', 'we ran', 'table get']",anecdotes/miscellaneous
Kudos Haru,"['kudo', 'haru']",['kudos haru'],anecdotes/miscellaneous
We arrived on time for our reservation and seated promptly.The,"['arriv', 'time', 'reserv', 'promptli', 'seat']","['seated promptly.the', 'we arrived']",anecdotes/miscellaneous
I plan on eating here more often.,"['often', 'eat', 'plan']","['more often', 'here more', 'i plan']",anecdotes/miscellaneous
"I would definitely go back for a very special occasion, but not for regular fine dining.","['go', 'regular', 'occas', 'special', 'would', 'definit', 'back', 'din', 'fine']","['', 'regular fine', 'special occasion', 'i go', 'not for', 'very special', 'regular dining', 'fine dining']",anecdotes/miscellaneous
"The well mannered, pleasant staff that Tony has in his employ.","['manner', 'staff', 'employ', 'toni', 'well', 'pleasant']","['pleasant staff', 'mannered staff', 'that has', 'tony has']",service
The flavors robust and subtle.,"['flavor', 'subtl', 'robust']",['robust flavors'],food
I came here for my friend's birthday and keep coming back ever since.,"['friend', 'keep', 'ever', 'sinc', 'birthday', 'back', 'come']","['back ever', 'i came']",anecdotes/miscellaneous
"All I can say is $2 pints during happy hour and the some of the cheapest oysters you'll find in the city, though the quality is some of the best.","['citi', 'though', 'best', 'happi', 'say', 'cheapest', 'oyster', 'hour', 'qualiti', 'find', 'pint']","['happy hour', 'i say', 'quality is', 'cheapest oysters', 'all is', 'you find']",food
"I would never wait for a table to eat, it just is not THAT great.","['wait', 'eat', 'never', 'tabl', 'would', 'great']","['i wait', 'it is', 'not is', 'never wait', 'table eat', 'that is', 'just is']",anecdotes/miscellaneous
"We concluded with tiramisu chocolate cake, both were delicious.","['delici', 'cake', 'chocol', 'tiramisu', 'conclud']","['tiramisu chocolate', 'both were', 'we concluded']",food
The counter service is bad.,"['counter', 'bad', 'servic']","['service is', 'counter service']",service
I had a grat time at Jekyll and Hyde!,"['jekyl', 'hyde', 'time', 'grat']","['i had', 'time had', 'grat time']",anecdotes/miscellaneous
"Service here was great, food was fantastic.","['food', 'fantast', 'great', 'servic']","['', 'food was', 'service was']",food
"its a little out of the way if you don't live in the neighborhood, but definitely worth the trip from wherever you are.","['littl', 'way', 'live', 'neighborhood', 'trip', 'worth', 'wherev', 'definit']","['you are', 'trip worth', ""n't live"", 'you live']",anecdotes/miscellaneous
"This is such a lovely, peaceful place to eat outside.","['peac', 'eat', 'outsid', 'place', 'love']","['peaceful place', 'this is', 'lovely place']",ambience
and we were thouroughly disapointed.,"['disapoint', 'thouroughli']","['we disapointed', 'thouroughly disapointed']",anecdotes/miscellaneous
This is the Jackel and Hideof the restaurants on the UES.,"['hideof', 'jackel', 'ue', 'restaur']","['this is', 'restaurants hideof']",anecdotes/miscellaneous
The sauce is delicious and the crust is perfect.,"['perfect', 'delici', 'crust', 'sauc']","['crust is', 'sauce is']",food
"This is a great place to take out-of-towners, and perfect for watching the sunset.","['take', 'place', 'perfect', 'towner', 'great', 'sunset', 'watch']","['take out-of-towners', 'sunset watching', 'great place', 'this is']",anecdotes/miscellaneous
Since my first dinner I have had the chance to have brunch at Orsay 3x.,"['chanc', 'orsay', 'brunch', 'x', 'dinner', 'first', 'sinc']","['first dinner', 'have brunch', 'chance had', 'orsay 3x', 'brunch have', 'i had']",anecdotes/miscellaneous
"You will pay a lot for the decore, but the food is no better or worse than a lot of other Chinese and Asian fusion places in NY.","['place', 'wors', 'ny', 'asian', 'lot', 'chines', 'food', 'decor', 'better', 'fusion', 'pay']","['food is', 'chinese fusion', 'other chinese', 'no better', 'you pay', 'other places', 'asian fusion', 'lot pay']",food
They have some great entrees here as well.,"['entre', 'great', 'well']","['', 'they have', 'here as', 'entrees have', 'as well']",food
"Our teenage kids love it, too.","['love', 'teenag', 'kid']","['', 'teenage kids', 'it love']",anecdotes/miscellaneous
The service is not consistently excellent -- just decent.,"['consist', 'servic', 'excel', 'decent']","['consistently excellent', 'not is', 'service is', 'not consistently']",service
"The food, served in small tasting portions (as an option) is very good with each dish being better than the next.","['small', 'good', 'option', 'dish', 'next', 'food', 'serv', 'better', 'portion', 'tast']","['small tasting', 'food is', 'small portions', 'very good', 'dish being']",food
You guys are awesome!,"['awesom', 'guy']",['guys are'],anecdotes/miscellaneous
"They do cater to American palates, but if you like it hot let them know and they are more than willing to oblige!","['know', 'hot', 'palat', 'like', 'cater', 'oblig', 'will', 'american', 'let']","['they are', 'american palates', 'you like', 'it hot', 'they cater', 'hot let', 'willing than', 'them know']",food
I loved this place!!,"['love', 'place']","['place loved', 'i loved']",anecdotes/miscellaneous
I had the mango chicken and i can't go on to tell you how delicious that was and the presentation was beatiful.,"['delici', 'tell', 'mango', 'go', 'chicken', 'present', 'beati']","['presentation was', 'you tell', 'chicken had', 'that was', 'i go', ""n't go"", 'i had']",food
I care more about the food and ambience.,"['food', 'ambienc', 'care']",['i care'],food
"Oh, but wait, we were out of drinks (which were also delightfully overpriced).","['wait', 'oh', 'also', 'drink', 'delight', 'overpric']","['delightfully overpriced', 'which overpriced', 'also delightfully', 'we were']",food
Avoid at all costs.,"['avoid', 'cost']","['m', 'p', 't', 'y']",anecdotes/miscellaneous
I would highly recommend this place to everyone for any occasion!,"['highli', 'place', 'recommend', 'occas', 'everyon', 'would']","['', 'place recommend', 'i recommend']",anecdotes/miscellaneous
The service is fantastic.,"['fantast', 'servic']",['service is'],service
I recommend that you try this hidden spot which will surely blowup very soon,"['soon', 'recommend', 'tri', 'sure', 'spot', 'hide', 'blowup']","['spot try', 'very soon', 'i recommend', 'you try', 'which blowup', 'surely blowup', 'hidden spot']",anecdotes/miscellaneous
The garlic mashed potatoes are hands down the best in the city!,"['citi', 'mash', 'potato', 'best', 'garlic', 'hand']","['garlic potatoes', 'potatoes are', 'mashed potatoes']",food
Food and service was okay.,"['food', 'okay', 'servic']",['food was'],food
"great for a romantic evening, or a fun evening with friends...","['romant', 'fun', 'great', 'friend', 'even']","['fun evening', 'romantic evening']",ambience
The lamb meat was under-cooked and EXTRMELY CHEWY.,"['lamb', 'extrm', 'cook', 'meat', 'chewi']","['cooked chewy', 'meat was', 'lamb meat']",food
The best pad thai i've ever had.,"['thai', 'ever', 'best', 'pad']","['i had', 'best pad', 'ever had']",food
"Over time, the food quality has decreased substantially, it is a lot less crowded than it used to, and the service must definitely be part of the reason.","['substanti', 'time', 'reason', 'use', 'decreas', 'must', 'lot', 'qualiti', 'less', 'servic', 'food', 'part', 'definit', 'crowd']","['quality decreased', 'less crowded', 'it is', 'it used', 'service be', 'be part', 'definitely be', 'lot less']",food
Great pizza and fantastic service.,"['fantast', 'great', 'servic', 'pizza']","['great pizza', 'fantastic service']",food
We were seated outside and the waiter spilled red wine and hot tea on myself and my date.,"['red', 'outsid', 'date', 'waiter', 'spill', 'tea', 'hot', 'wine', 'seat']","['we seated', 'waiter spilled', 'hot tea', 'wine spilled', 'red wine']",service
i would just ask for no oil next time.,"['time', 'oil', 'next', 'ask', 'would']","['just ask', 'i ask', 'next time', 'oil next']",anecdotes/miscellaneous
"While this is a pretty place in that overly cute French way, the food was insultingly horrible.","['way', 'place', 'cute', 'french', 'insultingli', 'pretti', 'horribl', 'food', 'overli']","['insultingly horrible', 'cute way', 'food was', 'cute french', 'french way', 'this is', 'overly cute', 'pretty place']",food
I went there for lunch and it was not as good as I expected from the reviews I read.,"['good', 'lunch', 'go', 'review', 'read', 'expect']","['as good', 'not was', 'it was', 'not as', 'i went', 'i expected', 'i read']",anecdotes/miscellaneous
I really didn't know what to expect for a restaurant that literally overlooks the main hall of Grand Central.,"['central', 'know', 'grand', 'restaur', 'liter', 'realli', 'overlook', 'main', 'expect', 'hall']","['i know', 'hall overlooks', 'main hall', 'grand central', ""n't know"", 'that overlooks', 'literally overlooks', 'what expect', 'really did']",anecdotes/miscellaneous
None of that yucky whipped stuff.,"['yucki', 'none', 'whip', 'stuff']","['yucky stuff', 'whipped stuff']",food
"The wine list isn't great, and the desserts are shipped in from Bruno's down the street, which is not as good as it used to be.","['dessert', 'good', 'ship', 'use', 'list', 'wine', 'bruno', 'great', 'street']","['', 'list is', ""n't is"", 'as good', 'it used', 'not is', 'not as', 'desserts shipped', 'which is', ""n't great""]",food
I ordered a Lassi and asked 4 times for it but never got it.,"['time', 'never', 'get', 'lassi', 'ask', 'order']","['i ordered', 'times asked', 'lassi ordered', 'it got', 'never got']",service
Their coffee is quite good too!,"['good', 'quit', 'coffe']","['', 'coffee is']",food
I would not recommend this place to anyone.,"['anyon', 'recommend', 'would', 'place']","['not recommend', 'place recommend', 'i recommend']",anecdotes/miscellaneous
"great wine list (italian), good food, service was INITIALLY fine.","['good', 'italian', 'initi', 'list', 'wine', 'servic', 'food', 'great', 'fine']","['', 'great wine', 'initially fine', 'list was', 'good food', 'great list']",food
"Despite the fact that the space is large, they've overcrowded the floor with tables.","['space', 'despit', 'fact', 'tabl', 'floor', 'larg', 'overcrowd']","['they overcrowded', 'floor overcrowded', 'space is']",ambience
"i know, you were too busy showing off your vintage tee shirt and looking bored, but my agenda is i'm here to eat and enjoy the company of friends, seeking a pleasant experience.","['eat', 'bore', 'shirt', 'know', 'busi', 'look', 'vintag', 'agenda', 'enjoy', 'experi', 'show', 'compani', 'tee', 'friend', 'pleasant', 'seek']","['i know', 'experience seeking', 'pleasant experience', 'shirt showing', 'you were', 'busy showing', 'agenda is', 'vintage shirt', ""i 'm"", 'company enjoy', 'too busy']",service
"As far as the service goes, the waitresses were not particularly friendly, but they got the job done.","['particularli', 'friendli', 'get', 'job', 'go', 'do', 'waitress', 'servic', 'far']","['as far', 'service goes', 'not particularly', 'they got', 'waitresses were', 'not were', 'particularly friendly', 'job done']",service
"They are not helpful in the least and will give you the grand run around so by the time the event date rolls around you will not only regret chosing this place, but also become hostile!","['roll', 'regret', 'event', 'give', 'time', 'least', 'date', 'place', 'grand', 'run', 'around', 'becom', 'also', 'chose', 'help', 'hostil']","['', 'not helpful', 'rolls regret', 'they are', 'place chosing', 'also become', 'not only', 'date rolls', 'only regret', 'run give', 'not are', 'grand run']",service
I had to ask her three times before she finally came back with the dish Ive requested.,"['time', 'dish', 'request', 'three', 'ive', 'ask', 'final', 'back', 'come']","['she came', 'her ask', 'i had', 'i requested', 'dish ive', 'finally came']",service
"Normally that would be improper, however they were all delicious and my host did not complain.","['delici', 'normal', 'complain', 'howev', 'improp', 'host', 'would']","['host complain', 'they were', 'not complain', 'that be']",food
Taxan delicious!,"['taxan', 'delici']",['taxan delicious'],food
"Perhaps it was an off night, but it was suprisingly average for a 9.3 rating.","['averag', 'night', 'rat', 'perhap', 'suprisingli']","['off night', 'it was', 'suprisingly average']",anecdotes/miscellaneous
"Unlike other places in NYC where the sandwiches you want only come as a triple-decker, here you can get what you want in a reasonably-sized portion (and price).","['sandwich', 'place', 'reason', 'get', 'tripl', 'decker', 'size', 'want', 'price', 'nyc', 'unlik', 'portion', 'come']","['triple decker', 'sized portion', 'what want', 'you want', 'only come', 'other places', 'you get', 'reasonably-sized portion', 'sandwiches come']",food
"Southern Indian cuisine is still there, too.","['still', 'southern', 'indian', 'cuisin']","['still there', 'cuisine is', 'southern cuisine', 'indian cuisine', 'southern indian']",food
"Restaurant snobs need not bother, this is a small, neighborhood kind of place.","['snob', 'small', 'kind', 'neighborhood', 'place', 'restaur', 'bother', 'need']","['snobs bother', 'small kind', 'neighborhood kind', 'this is', 'not bother']",anecdotes/miscellaneous
Have been dozens of times and never failed to enjoy the experience.,"['time', 'never', 'enjoy', 'experi', 'fail', 'dozen']","['been dozens', 'never failed', 'experience enjoy']",anecdotes/miscellaneous
They couldn't even make a salad that was appealing.,"['salad', 'appeal', 'even', 'make']","['even make', ""n't make"", 'they make', 'that appealing', 'salad make', ""n't even""]",food
For two people with tip was less than $25 bucks.,"['two', 'peopl', 'buck', 'tip', 'less']","['people was', '']",price
Killer Sushi!,"['killer', 'sushi']","['m', 'p', 't', 'y']",food
Of course the reason its so packed is because the food is so delicious!,"['cours', 'delici', 'reason', 'food', 'pack']","['food is', 'reason is', 'so delicious', 'so packed']",food
"Staffs are not that friendly, but the taste covers all.","['tast', 'staff', 'cover', 'friendli']","['all covers', 'taste covers', 'staffs are', 'not are']",food
The jukebox plays everything from Italian Opera to The Strokes.,"['italian', 'jukebox', 'stroke', 'everyth', 'play', 'opera']","['plays everything', 'everything plays', 'jukebox plays', 'italian opera']",ambience
And I've been to many NYC delis.,"['nyc', 'mani', 'deli']","['many delis', 'many nyc', 'i been', 'nyc delis']",anecdotes/miscellaneous
This place is always packed.,"['place', 'pack', 'alway']","['place is', 'always packed']",anecdotes/miscellaneous
Much of the time it seems like they do not care about you.,"['time', 'care', 'seem', 'like', 'much']","['they care', 'not care', 'it seems']",service
Plus they made a perfect martini.,"['perfect', 'plu', 'martini', 'make']","['', 'martini made', 'they made']",food
I am not sure if I would call the food here Indian as it is a fusion of what seems to be French with an Indian or exotic touch.,"['call', 'touch', 'french', 'exot', 'indian', 'sure', 'seem', 'food', 'would', 'fusion']","['here indian', 'not am', 'i am', 'it is', 'not sure', 'food call', 'exotic touch', 'what seems', 'i call']",food
"I've eaten thai many times, and am very familiar with the cuisine.","['thai', 'eat', 'time', 'cuisin', 'familiar', 'mani']","['many times', 'very familiar', 'thai eaten', 'thai many', 'i eaten']",anecdotes/miscellaneous
The waiter was attentive.,"['attent', 'waiter']",['waiter was'],service
Their Margarita is best I've had since I've returned from Naples!,"['margarita', 'return', 'best', 'sinc', 'napl']","['best i', 'margarita is', ""i 've"", 'i returned', 'i had']",food
I highly recommend the restaurant based on our experience last night.,"['highli', 'base', 'last', 'recommend', 'night', 'restaur', 'experi']","['highly recommend', 'experience last', 'i recommend', 'last night', 'restaurant recommend']",anecdotes/miscellaneous
The tastes makes your mouth water for more.,"['tast', 'mouth', 'water', 'make']","['water makes', 'tastes makes', 'mouth water']",food
