reviews,lemmas,ufeat,aspectCategory
"Besides having the table we had been promised given to other restaurant patrons twice before we were actually seated, we were served dishes we hadn't ordered three times, received one of our orders 20 minutes after the rest of the table had been served (and that order was undercooked), and charged $45 more than we should have been on our bill.","['minut', 'restaur', 'three', 'receiv', 'actual', 'seat', 'patron', 'tabl', 'charg', 'order', 'one', 'dish', 'promis', 'time', 'twice', 'undercook', 'serv', 'give', 'besid', 'bill', 'rest']","['table having', 'we been', 'one received', 'we promised', '45 charged', 'actually seated', 'we seated', ""n't ordered"", 'we served', 'more 45', 'restaurant patrons', 'dishes served', 'served dishes', 'other restaurant', 'we ordered', 'order undercooked', 'other patrons', 'rest served']",service
Service is top notch.,"['top', 'notch', 'servic']","['service is', 'top notch']",service
The food now is inconsistent.,"['food', 'inconsist']","['food is', 'now is']",food
All pretty good.,"['good', 'pretti']",['pretty good'],anecdotes/miscellaneous
"You can also special order any kind of dumpling,etc.","['kind', 'special', 'also', 'etc', 'dumpl', 'order']","['you order', 'kind order', 'special order', 'also special']",anecdotes/miscellaneous
you guys rock.,"['guy', 'rock']",['guys rock'],anecdotes/miscellaneous
Chance is a joke.,"['joke', 'chanc']",[''],anecdotes/miscellaneous
I was pretty much full after our fondue appetizer.,"['appet', 'pretti', 'full', 'fondu', 'much']","['much full', 'pretty much', 'i was', 'fondue appetizer']",food
BE CAREFUL before you request extra spice.,"['extra', 'spice', 'request', 'care']","['', 'spice request', 'you request']",food
The octopus eaters were floored by the Octopus salad.,"['eater', 'floor', 'salad', 'octopu']",['eaters floored'],food
We thought that this place is using too much of MSG cooking in the foods.,"['place', 'msg', 'think', 'use', 'cook', 'food', 'much']","['place using', 'too much', 'we thought', 'much using']",food
I was at Rao's last Wed.,"['rao', 'wed', 'last']","['last d', 'last wed', 'i was', 'we d']",anecdotes/miscellaneous
And the Tom Kha soup was pathetic.,"['soup', 'pathet', 'kha', 'tom']","['soup was', 'kha soup', 'tom soup']",food
I started out with a Bombay beer which was big enough for two.,"['start', 'enough', 'big', 'two', 'bombay', 'beer']","['i started', 'which was']",food
"The decor is vibrant and eye-pleasing with several semi-private boths on the right side of the dining hall, which are great for a date.","['din', 'sever', 'privat', 'great', 'date', 'pleas', 'semi', 'right', 'side', 'eye', 'decor', 'vibrant', 'both', 'hall']","['decor is', 'which are', 'private boths', 'semi-private boths', 'dining hall', 'several boths', 'right side', 'several semi-private']",ambience
Service was quick.,"['servic', 'quick']",['service was'],service
Tends to turn people away.,"['away', 'tend', 'peopl', 'turn']","['turn people', 'people turn']",anecdotes/miscellaneous
We thought this a prelude to what the evening will be like.,"['think', 'like', 'prelud', 'even']","['this prelude', 'evening be', '']",anecdotes/miscellaneous
"I was turned on to this restaurant by a fellow foodie friend of mine, and have been going back regularly ever since.","['foodi', 'ever', 'go', 'restaur', 'fellow', 'back', 'sinc', 'mine', 'friend', 'regularli', 'turn']","['foodie friend', 'fellow friend', 'regularly ever', 'back regularly', 'i turned', 'fellow foodie']",anecdotes/miscellaneous
Drawbacks: service is slow and they don't toast!,"['toast', 'drawback', 'servic', 'slow']","['service is', ""n't toast"", 'they toast']",service
Went there for an office lunch.,"['offic', 'go', 'lunch']","['m', 'p', 't', 'y']",anecdotes/miscellaneous
I have been doing all of the above at the Heartland Brewery for over 5 years now and I HAVE NEVER BEEN DISAPPOINTED!,"['never', 'breweri', 'heartland', 'year', 'disappoint']","['never been', 'i doing', 'all doing', 'i been']",anecdotes/miscellaneous
"Everytime I decide to try another place on the UES, I get angry that I didn't just go to Zucchero Pomodori.","['everytim', 'place', 'get', 'tri', 'decid', 'anoth', 'go', 'pomodori', 'ue', 'angri', 'zucchero']","['i decide', 'place try', ""n't just"", 'i get', 'just go', 'i go', ""n't go""]",anecdotes/miscellaneous
The sweet lassi was excellent as was the lamb chettinad and the garlic naan but the rasamalai was forgettable.,"['lamb', 'sweet', 'naan', 'forgett', 'chettinad', 'lassi', 'garlic', 'excel', 'rasamalai']","['lassi was', 'rasamalai was', 'chettinad was', 'sweet lassi', 'garlic naan', 'lamb chettinad']",food
"We've been following chef Lyle's food around New York for 15 years and while remaining classic, his innovations with bistro fare have made us return and return.","['new', 'bistro', 'follow', 'lyle', 'remain', 'make', 'return', 'us', 'around', 'fare', 'york', 'chef', 'food', 'classic', 'year', 'innov']","['remaining classic', 'food following', 'us return', 'we following', 'new york', 'bistro fare', 'innovations made', 'following chef']",food
The best thing I tasted were the lambchops.,"['tast', 'lambchop', 'thing', 'best']","['thing were', 'i tasted', 'best thing']",food
it's delicious!,['delici'],"[""it 's""]",food
The spicy tuna and salmon are the best we've ever had.,"['tuna', 'best', 'spici', 'salmon', 'ever']","['spicy tuna', 'we had', 'tuna are', 'ever had']",food
"Even though its good seafood, the prices are too high.","['though', 'good', 'seafood', 'price', 'high', 'even']","['good seafood', 'too high', 'prices are']",food
"In addition, the food is very good and the prices are reasonable.","['good', 'reason', 'addit', 'price', 'food']","['food is', 'very good', 'prices are']",food
"Upon entering, we were greeted by the owners, Steven and Frederick, who went out of their way to be more than gracious hosts.","['steven', 'way', 'graciou', 'frederick', 'go', 'upon', 'greet', 'host', 'enter', 'owner']","['we greeted', 'gracious hosts', 'who went']",service
"If you live outside the neighborhood, don't bother!","['bother', 'live', 'outsid', 'neighborhood']","[""n't bother"", 'you live']",anecdotes/miscellaneous
Been going here since it opened have seen the quality value decrease considerably.,"['see', 'consider', 'go', 'decreas', 'qualiti', 'open', 'sinc', 'valu']","['it opened', 'decrease seen']",anecdotes/miscellaneous
"Meat dishes now adorn the selections, although there's still a large number of vegetarian-friendly choices.","['number', 'dish', 'friendli', 'although', 'select', 'larg', 'adorn', 'choic', 'vegetarian', 'meat', 'still']","['selections adorn', 'large number', 'friendly choices', 'dishes adorn', 'vegetarian-friendly choices', 'now adorn']",food
I never had anything I didn't like here.,"['anyth', 'like', 'never']","['i like', 'had anything', 'anything had', ""n't like"", 'never had', 'i had']",anecdotes/miscellaneous
Reasonable prices.,"['price', 'reason']",['reasonable prices'],price
they bring service up a notch by offerng complementary amuse bouche to all tables and gave us a small dessert for our celebration.,"['small', 'dessert', 'bouch', 'give', 'complementari', 'offerng', 'tabl', 'amus', 'celebr', 'us', 'notch', 'servic', 'bring']","['small dessert', 'offerng complementary', 'notch bring', 'dessert gave', 'bring service', 'they bring', 'complementary amuse', 'service bring', 'offerng bouche']",service
"Try the crunchy tuna, it is to die for.","['die', 'tuna', 'tri', 'crunchi']","['tuna try', 'it is', 'crunchy tuna']",food
It won't break the bank but I also wouldnt come back for the food.,"['wouldnt', 'bank', 'also', 'food', 'back', 'come', 'break']","['bank break', 'also wouldnt', 'it break', 'i come', ""n't break""]",food
"All in all, this midtown gem instantly became one of my favorite sushi restaurants in the city.","['gem', 'citi', 'midtown', 'one', 'sushi', 'restaur', 'instantli', 'becom', 'favorit']","['favorite sushi', 'midtown gem', 'gem became', 'favorite restaurants', 'instantly became']",anecdotes/miscellaneous
I've been to Joya twice and I will never go again.,"['joya', 'go', 'twice', 'never']","['i go', 'never go', 'i been']",anecdotes/miscellaneous
So rushing us out was absolutely unnecessary!,"['rush', 'unnecessari', 'us', 'absolut']","['absolutely unnecessary', 'so rushing', 'us rushing']",anecdotes/miscellaneous
However it is the ONLY Taiwanese restaurant in town.,"['town', 'taiwanes', 'howev', 'restaur']","['only taiwanese', 'it is', 'only restaurant', 'taiwanese restaurant']",anecdotes/miscellaneous
It is a lot of fun with live entertainment and all kinds of Disney type special effects.,"['kind', 'type', 'lot', 'special', 'fun', 'live', 'effect', 'entertain', 'disney']","['', 'live entertainment', 'special effects', 'it is']",ambience
"if you're looking for perfect traditional sushi, go here - if you're looking for interesting combinations, try sushi of gari's (east side).","['gari', 'perfect', 'look', 'sushi', 'go', 'tri', 'tradit', 'interest', 'combin', 'side', 'east']","['you looking', 'interesting combinations', 'sushi try', 'perfect traditional', 'east side', 'perfect sushi', 'try sushi', 'traditional sushi']",food
"No refills on fountain drinks, though.","['though', 'fountain', 'refil', 'drink']","['m', 'p', 't', 'y']",food
Wow over 100 beers to choose from.,"['wow', 'beer', 'choos']","['m', 'p', 't', 'y']",food
Be careful of portions - they're HUGE.,"['huge', 'portion', 'care']","[""they 're""]",food
"The Steak Tartare is a great bet, they fix it for you at the table.","['steak', 'tabl', 'tartar', 'fix', 'great', 'bet']","['tartare is', 'great bet', 'it fix', 'they fix']",food
My first time there I happened not to like the Crab Croquette apt that i ordered and they were happy to change it for me without making no big deal.,"['chang', 'croquett', 'without', 'time', 'big', 'happi', 'make', 'crab', 'apt', 'happen', 'like', 'first', 'deal', 'order']","['i ordered', 'that ordered', 'they were', 'i happened', 'it change', 'big deal', 'first time', 'not to', 'deal making']",service
Great for large groups and celebrations - our SUPER HAPPY waiter was the entertainment of the evening.,"['group', 'celebr', 'happi', 'waiter', 'even', 'super', 'larg', 'great', 'entertain']","['entertainment was', 'waiter was', 'super happy', 'happy waiter', 'large groups']",service
Did I mention the wine?,"['wine', 'mention']","['i mention', 'wine mention']",food
"Plus, on Wednesday nights the house wine is unlimited!","['night', 'plu', 'wednesday', 'wine', 'unlimit', 'hous']","['wednesday nights', 'wine is']",food
It is by far my favorite restaurant in Brooklyn.,"['favorit', 'far', 'restaur', 'brooklyn']","['it is', 'favorite restaurant']",anecdotes/miscellaneous
Now it's so crowded and loud you can't even talk to the person next to you.,"['loud', 'person', 'talk', 'next', 'even', 'crowd']","['you talk', 'so crowded', 'even talk', ""n't even"", ""n't talk"", 'person next', ""it 's""]",ambience
Love Pizza 33..,"['love', 'pizza']",['love pizza'],anecdotes/miscellaneous
Even my Indian friend couldn't believe how good and tasty everything was.,"['good', 'tasti', 'indian', 'everyth', 'friend', 'believ', 'even']","[""n't believe"", 'tasty everything', 'indian friend', 'everything was', 'friend believe']",food
"I'm from England, and Haru's was the best I had in NYC.","['haru', 'nyc', 'england', 'best']","['', 'i had', ""i 'm""]",anecdotes/miscellaneous
Less = More in their case.,"['case', 'less']",['= more'],anecdotes/miscellaneous
Ruby Foo's is a tourist trap.,"['trap', 'tourist', 'foo', 'rubi']",['foo is'],anecdotes/miscellaneous
I've been here a couple of times and have not been impressed.,"['coupl', 'impress', 'time']","['not impressed', 'i been', 'not been']",anecdotes/miscellaneous
I've been many time and have never been disappointed.,"['disappoint', 'mani', 'time', 'never']","['never been', 'many time', 'i been']",anecdotes/miscellaneous
Ciao Bella,"['ciao', 'bella']",['bella ciao'],anecdotes/miscellaneous
like saying her bread comes from a special bakery when we have seen her buying it dowtown manhathan.,"['see', 'bread', 'say', 'buy', 'special', 'dowtown', 'like', 'bakeri', 'manhathan', 'come']","['dowtown manhathan', 'bread comes', 'it dowtown', 'special bakery', 'we seen', 'buying seen']",food
The dim sum servings here are a bit larger than I'm used to.,"['dim', 'larger', 'use', 'bite', 'serv', 'sum']","['bit larger', 'servings are', 'dim servings', 'i used', 'here are']",food
"However, in the summer of 2003, it seems the management has changed and the great big door has been replaced for a glass front ridding itself of the dark romantic getup.","['manag', 'replac', 'chang', 'big', 'getup', 'summer', 'romant', 'glass', 'door', 'front', 'dark', 'seem', 'howev', 'great', 'rid']","['', 'great door', 'dark getup', 'management changed', 'romantic getup', 'big door', 'door replaced', 'itself ridding', 'it seems', 'great big']",service
We won't go to this place again for a good meal.,"['meal', 'good', 'go', 'place']","[""n't go"", 'we go', 'good meal']",food
It's a much more grown up restaurant compared to the rest of the street.,"['compar', 'restaur', 'grow', 'much', 'rest', 'street']","['more grown', 'much more', 'grown restaurant', ""it 's""]",ambience
"Barbecued codfish was gorgeously moist - as if poached - yet the fabulous texture was let down by curiously bland seasoning - a spice rub might have overwhelmed, however herb mix or other sauce would have done much to enhance.","['textur', 'gorgeous', 'season', 'might', 'barbecu', 'much', 'rub', 'mix', 'bland', 'moist', 'howev', 'yet', 'let', 'sauc', 'spice', 'fabul', 'poach', 'would', 'herb', 'curious', 'do', 'enhanc', 'codfish', 'overwhelm']","['other sauce', '', 'gorgeously moist', 'texture let', 'however herb', 'barbecued codfish', 'rub overwhelmed', 'codfish was', 'much done', 'herb mix']",food
We were treated with attitude ever since the moment we stepped into the restaurant!,"['treat', 'restaur', 'sinc', 'moment', 'attitud', 'step', 'ever']","['we stepped', 'we treated']",service
"After dinner, take your date to the HUGE dance floor, probably one of the biggest you'll see in NY.","['see', 'take', 'date', 'one', 'ny', 'danc', 'probabl', 'floor', 'biggest', 'dinner', 'huge']","['huge dance', 'you see', 'huge floor', 'date take']",ambience
Taj Mahal offeres gret value and great food.,"['offer', 'mahal', 'gret', 'taj', 'food', 'great', 'valu']","['gret value', 'taj offeres', 'value offeres', 'mahal offeres', 'great food']",food
Has the chef and owner changed???,"['owner', 'chang', 'chef']",['chef changed'],service
My boyfriend and I recently had an early dinner at Artisanal and was satisfied with our experience.,"['satisfi', 'artisan', 'recent', 'boyfriend', 'earli', 'dinner', 'experi']","['artisanal dinner', 'early dinner', 'dinner had', 'recently had', 'boyfriend had']",anecdotes/miscellaneous
I absolutely Loved this place.,"['love', 'place', 'absolut']","['place loved', 'i loved', 'absolutely loved']",anecdotes/miscellaneous
I wish I lived there as I would eat at this place as often as possible!,"['eat', 'place', 'wish', 'possibl', 'often', 'would', 'live']","['wish i', 'as often', 'i lived', 'possible as', 'i eat', 'i wish']",anecdotes/miscellaneous
"But don't ever order bacon late at nite (either platter or in sandwiches, for that matter don't from any take out place) as it is from the morning frying turns out hard almost like bacos, hurt my molars.","['platter', 'sandwich', 'almost', 'take', 'place', 'bacon', 'baco', 'late', 'molar', 'fri', 'matter', 'morn', 'hard', 'like', 'hurt', 'either', 'ever', 'nite', 'turn', 'order']","[""n't order"", 'it is', ""n't from"", 'bacon turns', ""n't ever"", 'molars hurt', 'take place', 'hard almost']",food
"Outstanding Bagels, but you get what you pay for.","['bagel', 'outstand', 'pay', 'get']","['outstanding bagels', 'you get', 'you pay']",food
"Pizza - the only pizza in NYC that should not have additional toppings - the crust tastes like the best, freshly baked bread!","['top', 'best', 'bread', 'freshli', 'bake', 'addit', 'crust', 'like', 'tast', 'nyc', 'pizza']","['not have', 'freshly baked', 'baked bread', 'toppings have', 'that have', 'crust tastes', 'additional toppings', 'only pizza', 'best bread']",food
"If you're in town, it's worth searching for another place.","['place', 'town', 'anoth', 'worth', 'search']","[""you 're"", ""it 's"", 'worth searching']",anecdotes/miscellaneous
I have tried the various slice joints around the village but this is by far the best one.,"['one', 'best', 'variou', 'tri', 'around', 'joint', 'far', 'slice', 'villag']","['i tried', 'best one', 'various slice', 'joints tried', 'various joints', 'this is']",anecdotes/miscellaneous
"I found it on a cold night, the perfect spot to warm up.","['perfect', 'night', 'spot', 'find', 'cold', 'warm']","['it found', 'cold night', 'perfect spot', 'spot warm', 'i found']",ambience
They even have a section in the menu called American Chinese food!,"['call', 'section', 'menu', 'chines', 'food', 'american', 'even']","['they have', 'american chinese', 'even have', 'section have', 'chinese food', 'american food']",food
"Service was warm and attentive, beef carpaachio was exellent (huge portion) and pasta was fresh and well-prepared.","['beef', 'prepar', 'carpaachio', 'well', 'attent', 'fresh', 'exel', 'pasta', 'servic', 'huge', 'warm', 'portion']","['pasta was', 'huge portion', 'carpaachio was', 'service was']",food
kalbi and nebbiolo do work together.,"['kalbi', 'work', 'togeth', 'nebbiolo']","['', 'kalbi work']",food
"Best Italian food I ever had (and being Italian, that means alot).","['best', 'italian', 'mean', 'alot', 'food', 'ever']","['alot means', 'best italian', 'italian food', 'means alot', 'ever had', 'that means', 'i had', 'best food']",food
I will recommend Scopa to all of my friends for a place to go for wonderful Italian food.,"['place', 'italian', 'recommend', 'go', 'food', 'scopa', 'friend', 'wonder']","['scopa recommend', 'i recommend', 'italian food', 'recommend scopa', 'wonderful italian', 'wonderful food']",food
Located at the end of a magnificent block.,"['magnific', 'end', 'block', 'locat']",['magnificent block'],ambience
"This restaurant is not worth the time, effort, or money to say the least.","['effort', 'time', 'least', 'say', 'money', 'worth', 'restaur']","['least say', 'not is', 'restaurant is']",price
"Looking around, I saw a room full of New Yorkers enjoying a real meal in a real restaurant, not a clubhouse of the fabulous trying to be seen.","['room', 'see', 'real', 'new', 'look', 'fabul', 'tri', 'restaur', 'around', 'meal', 'enjoy', 'full', 'clubhous', 'saw', 'yorker']","['i saw', 'real restaurant', 'fabulous trying', 'new yorkers', 'room saw', 'real meal', 'meal enjoying', 'full room', 'not restaurant', 'room full']",ambience
Keep up the good work guys!,"['good', 'keep', 'work', 'guy']","['good work', 'good guys', 'guys keep']",anecdotes/miscellaneous
Hurley's is terrific!,"['hurley', 'terrif']",['hurley is'],anecdotes/miscellaneous
They don't walk around with the trays of Dim Sum.,"['dim', 'walk', 'around', 'tray', 'sum']","['', 'dim sum', 'they walk']",ambience
Took my sister here before attending a show one evening.,"['attend', 'one', 'take', 'show', 'sister', 'even']","['', 'sister took', 'before attending', 'show attending']",anecdotes/miscellaneous
"Great bar, most gorgeous bartenders you've ever seen (specifically the blond lady).","['bartend', 'see', 'blond', 'specif', 'ladi', 'gorgeou', 'bar', 'great', 'ever']","['blond lady', 'ever seen', 'most gorgeous', 'great bar', 'you seen', 'gorgeous bartenders']",service
We were planning to get dessert but the waitress basically through the bill at us before we had a chance to order.,"['dessert', 'chanc', 'get', 'us', 'bill', 'waitress', 'basic', 'plan', 'order']","['dessert get', 'we had', 'chance had', 'we planning']",service
Really.,['realli'],"['m', 'p', 't', 'y']",anecdotes/miscellaneous
I really loved the different and inovated touch that's the cheff gives to the food.,"['give', 'touch', 'love', 'inov', 'realli', 'differ', 'food', 'cheff']","['i loved', 'cheff gives', 'touch loved', ""that 's"", 'inovated touch', 'really loved', 'different touch']",food
Our friends have not arrived yet.,"['arriv', 'yet', 'friend']","['', 'friends arrived']",anecdotes/miscellaneous
They came out over cooked and the cheese was almost non existant.,"['almost', 'exist', 'cook', 'non', 'chees', 'come']","['they came', 'cheese was', 'non existant', 'almost non']",food
"I had a terrific meal, and our server guided us toward a very nice wine in our price range, instead of allowing us to purchase a similarly priced wine that wasn't as good.","['rang', 'good', 'toward', 'terrif', 'server', 'purchas', 'guid', 'us', 'nice', 'meal', 'similarli', 'wine', 'allow', 'price', 'instead']","['', 'us guided', 'wine purchase', ""n't was"", 'server guided', 'as good', 'that was', 'meal had', 'nice wine', 'similarly priced', 'terrific meal', 'i had', ""n't as"", 'us purchase', 'very nice']",food
"The svc can be a bit rude at times, esp if you have big group, but overall the restaurant is a must!","['group', 'time', 'big', 'esp', 'restaur', 'bite', 'rude', 'overal', 'svc', 'must']","['group have', 'svc be', 'restaurant is', 'big group', 'you have']",service
"My husband and I thougt it would be great to go to the Jekyll and Hyde Pub for our anniversary, and to our surprise it was fantastic.","['pub', 'jekyl', 'husband', 'go', 'thougt', 'surpris', 'fantast', 'hyde', 'would', 'great', 'anniversari']","['', 'it be', 'it was']",anecdotes/miscellaneous
Never once did I leave feeling unwelcome or impressed.,"['feel', 'never', 'impress', 'leav', 'unwelcom']","['', 'i leave', 'never once', 'once did']",anecdotes/miscellaneous
"The food is good, especially their more basic dishes, and the drinks are delicious.","['good', 'delici', 'dish', 'drink', 'food', 'basic', 'especi']","['food is', 'basic dishes', 'drinks are', 'more basic']",food
But the main hit was the whole grilled fish.,"['fish', 'whole', 'grill', 'hit', 'main']","['whole fish', 'whole grilled', 'grilled fish', 'main hit', 'hit was']",food
"I had the tuna tartare with sake, mushroom ravioli with pinot noir, and the chocolate sampler with a dessert wine for $49.","['dessert', 'tuna', 'tartar', 'pinot', 'sake', 'ravioli', 'wine', 'mushroom', 'noir', 'chocol', 'sampler']","['i had', 'dessert wine', 'tuna tartare']",price
On a hot day it was fabulous to stop in and enjoy lunch.,"['lunch', 'hot', 'day', 'enjoy', 'fabul', 'stop']","['it was', 'enjoy lunch', 'hot day', 'lunch enjoy']",anecdotes/miscellaneous
The food is delicious and beautifully prepared along with the friendly and personable service.,"['delici', 'friendli', 'person', 'along', 'beauti', 'servic', 'food', 'prepar']","['food is', 'friendly service', 'personable service', 'beautifully prepared']",food
I usually go there later at night when I get off work so I don't have to deal with crowds or lines.,"['work', 'usual', 'later', 'get', 'go', 'night', 'line', 'deal', 'crowd']","['there later', 'usually go', 'i get', ""n't have"", 'i go', 'work get', 'i do', 'i have', 'so i']",anecdotes/miscellaneous
Pizza here is consistently good.,"['consist', 'good', 'pizza']","['', 'pizza is', 'consistently good']",food
We had a great tiem watching the shows and characters and ar food was just what we were looking for.,"['tiem', 'charact', 'look', 'ar', 'show', 'food', 'great', 'watch']","['great tiem', 'we had', 'ar food', 'shows watching', 'food was', 'we looking', 'tiem had']",food
"After 2 tries by the waiter to take it away (we hadn't even looked at it yet, we had full beers yet to drink), the manager approached and told us they needed the table for people with reservations.","['manag', 'take', 'tell', 'waiter', 'tabl', 'look', 'tri', 'approach', 'peopl', 'us', 'away', 'reserv', 'full', 'drink', 'need', 'yet', 'beer', 'even']","['full beers', ""n't looked"", 'table needed', 'it take', 'we looked', 'we had', 'they needed', 'beers had', 'manager approached', ""n't even"", 'us told', 'even looked']",service
Wouldn't recomend it for dinner!,"['recomend', 'dinner']","[""n't recomend"", 'it recomend']",anecdotes/miscellaneous
Sauce was watery and the food didn't have much flavor.,"['sauc', 'flavor', 'food', 'wateri', 'much']","['was watery', 'flavor have', 'much flavor', ""n't have"", 'sauce was', 'food have']",food
My husband and I enjoy Sangria.,"['enjoy', 'sangria', 'husband']","['sangria enjoy', 'i enjoy']",food
"But after last night, Spice Grill is the only place I'm eating indian cuisine.","['eat', 'spice', 'place', 'last', 'night', 'indian', 'grill', 'cuisin']","['cuisine eating', 'only place', 'i eating', 'last night', 'indian cuisine', 'grill is']",food
We both opted for a pasta dish and they were served timely and fresh.,"['opt', 'time', 'dish', 'fresh', 'pasta', 'serv']","['they served', 'we opted', 'pasta dish']",service
"First the wrong bread came out with the appetizer, then when i tried to order a second glass of wine for my main course...","['cours', 'bread', 'tri', 'wrong', 'appet', 'glass', 'second', 'wine', 'main', 'first', 'come', 'order']","['second glass', 'bread came', 'i tried', 'glass order', 'main course', 'wrong bread']",service
"Not sure where the previous reviewer, lonk, dined, but Saul is in a great neighborhood and has great food!","['previou', 'neighborhood', 'sure', 'review', 'saul', 'food', 'great', 'lonk', 'din']","['food has', 'saul is', 'not sure', 'great neighborhood', 'great food', 'reviewer dined', 'previous reviewer']",food
"In an area sadly lacking in decent Thai food, this is one of the best spots.","['thai', 'area', 'sadli', 'decent', 'one', 'best', 'spot', 'food', 'lack']","['decent food', 'sadly lacking', 'decent thai', 'thai food', 'best spots', 'this is']",food
