reviews,lemmas,lemmas,aspectCategory
The sauces used are also not that exciting.,"['sauc', 'excit', 'use', 'also']","['sauc', 'excit', 'use', 'also']",food
The secret is the lunch menu which offers a complimentary appetizer with every entree ordered.,"['order', 'complimentari', 'everi', 'menu', 'appet', 'offer', 'entre', 'lunch', 'secret']","['order', 'complimentari', 'everi', 'menu', 'appet', 'offer', 'entre', 'lunch', 'secret']",food
I absolutely love this place!!!,"['place', 'love', 'absolut']","['place', 'love', 'absolut']",anecdotes/miscellaneous
The rice was poor quality and was cooked so badly it was hard.,"['qualiti', 'poor', 'badli', 'rice', 'hard', 'cook']","['qualiti', 'poor', 'badli', 'rice', 'hard', 'cook']",food
We had champagne and caviar and felt like princesses!,"['like', 'princess', 'champagn', 'caviar', 'felt']","['like', 'princess', 'champagn', 'caviar', 'felt']",food
The shrimp scampi was excellent and the antipasti were plentiful.,"['shrimp', 'excel', 'scampi', 'plenti', 'antipasti']","['shrimp', 'excel', 'scampi', 'plenti', 'antipasti']",food
I am surprised to say the least and find such practice not worth the effort.,"['find', 'effort', 'surpris', 'practic', 'least', 'say', 'worth']","['find', 'effort', 'surpris', 'practic', 'least', 'say', 'worth']",anecdotes/miscellaneous
"When my dessert came, there was a candle in it - not because anyone asked for one - but because the waiter must have seen me opening my birthday card and gift, and said he knew it was a special occassion of some sort.","['come', 'anyon', 'waiter', 'card', 'sort', 'occass', 'gift', 'see', 'know', 'candl', 'dessert', 'one', 'say', 'must', 'special', 'birthday', 'open', 'ask']","['come', 'anyon', 'waiter', 'card', 'sort', 'occass', 'gift', 'see', 'know', 'candl', 'dessert', 'one', 'say', 'must', 'special', 'birthday', 'open', 'ask']",service
"I got the $10 10-piece dim sum combo, every bite of which was great.","['get', 'great', 'everi', 'piec', 'combo', 'sum', 'bite', 'dim']","['get', 'great', 'everi', 'piec', 'combo', 'sum', 'bite', 'dim']",price
There are other Vietnamese restaurants in the chinatown area and you can forget about those.,"['restaur', 'area', 'forget', 'vietnames', 'chinatown']","['restaur', 'area', 'forget', 'vietnames', 'chinatown']",anecdotes/miscellaneous
There is also very limited seating and there can be a substantial wait in getting food at peak times.,"['time', 'get', 'substanti', 'seat', 'also', 'peak', 'wait', 'limit', 'food']","['time', 'get', 'substanti', 'seat', 'also', 'peak', 'wait', 'limit', 'food']",ambience
"If it's just a quick martini at the bar (which I recommend Jeffery's) or a mind blowing Roast Chicken, go to Village!","['roast', 'villag', 'mind', 'chicken', 'recommend', 'martini', 'jefferi', 'quick', 'bar', 'go', 'blow']","['roast', 'villag', 'mind', 'chicken', 'recommend', 'martini', 'jefferi', 'quick', 'bar', 'go', 'blow']",food
No thanks!!!,['thank'],['thank'],anecdotes/miscellaneous
"There was a long wait for a table outside, but it was a little too hot in the sun anyway so our insde table was very nice.","['tabl', 'hot', 'outsid', 'sun', 'nice', 'littl', 'wait', 'long', 'insd', 'anyway']","['tabl', 'hot', 'outsid', 'sun', 'nice', 'littl', 'wait', 'long', 'insd', 'anyway']",service
I would definently recommend this restaurant.,"['would', 'restaur', 'defin', 'recommend']","['would', 'restaur', 'defin', 'recommend']",anecdotes/miscellaneous
The prices are wonderfully low.,"['price', 'wonder', 'low']","['price', 'wonder', 'low']",price
If you like spicy food get the chicken vindaloo.,"['like', 'get', 'spici', 'chicken', 'food', 'vindaloo']","['like', 'get', 'spici', 'chicken', 'food', 'vindaloo']",food
I lOVE THIS PLACE!,"['place', 'love']","['place', 'love']",anecdotes/miscellaneous
I have never been disappointed but their true strength lays in their amazingly delicious and cheap lunch specials.,"['disappoint', 'true', 'amazingli', 'strength', 'lay', 'lunch', 'cheap', 'never', 'special', 'delici']","['disappoint', 'true', 'amazingli', 'strength', 'lay', 'lunch', 'cheap', 'never', 'special', 'delici']",food
"So much more than the usual bar food, go there to enjoy the menu while sampling one of their hand-crafted beers.","['hand', 'usual', 'much', 'beer', 'one', 'go', 'enjoy', 'menu', 'bar', 'food', 'sampl', 'craft']","['hand', 'usual', 'much', 'beer', 'one', 'go', 'enjoy', 'menu', 'bar', 'food', 'sampl', 'craft']",food
"A big disappointment, all around.","['big', 'disappoint', 'around']","['big', 'disappoint', 'around']",anecdotes/miscellaneous
And its absolutely DELICIOUS.,"['delici', 'absolut']","['delici', 'absolut']",food
No free drink.,"['free', 'drink']","['free', 'drink']",price
I would say that all was fine and tasty but the heaviness on my stomach someting that i can't not mention or undermine.,"['stomach', 'somet', 'undermin', 'heavi', 'fine', 'would', 'say', 'mention', 'tasti']","['stomach', 'somet', 'undermin', 'heavi', 'fine', 'would', 'say', 'mention', 'tasti']",food
This is my first time writing a review for a restaurant because the food and service was excellent.,"['write', 'time', 'restaur', 'first', 'excel', 'servic', 'food', 'review']","['write', 'time', 'restaur', 'first', 'excel', 'servic', 'food', 'review']",food
Definitely Highly NOT recommended.,"['highli', 'recommend', 'definit']","['highli', 'recommend', 'definit']",anecdotes/miscellaneous
"While they keep the capex to a minimum, they do put some cash into the bagels, because they among the best in the city.","['keep', 'best', 'citi', 'capex', 'cash', 'bagel', 'put', 'among', 'minimum']","['keep', 'best', 'citi', 'capex', 'cash', 'bagel', 'put', 'among', 'minimum']",food
I had a huge group for my birthday and we were well taken care of.,"['huge', 'well', 'care', 'group', 'take', 'birthday']","['huge', 'well', 'care', 'group', 'take', 'birthday']",service
The two star chefs left quite some time ago to open their own place.,"['chef', 'time', 'star', 'leav', 'quit', 'place', 'two', 'open', 'ago']","['chef', 'time', 'star', 'leav', 'quit', 'place', 'two', 'open', 'ago']",anecdotes/miscellaneous
Don't waste money on decor.,"['decor', 'wast', 'money']","['decor', 'wast', 'money']",ambience
They also have a back garden open in the summer - cute and French with outdoor seating - what more could you ask for?,"['back', 'cute', 'could', 'also', 'seat', 'garden', 'outdoor', 'open', 'french', 'summer', 'ask']","['back', 'cute', 'could', 'also', 'seat', 'garden', 'outdoor', 'open', 'french', 'summer', 'ask']",ambience
"go to any corned indian restaurant, and the little india strip along east 6 st rules supreme!","['corn', 'restaur', 'suprem', 'strip', 'east', 'st', 'rule', 'littl', 'indian', 'india', 'go', 'along']","['corn', 'restaur', 'suprem', 'strip', 'east', 'st', 'rule', 'littl', 'indian', 'india', 'go', 'along']",anecdotes/miscellaneous
I have never before eaten 40 pieces of relatively good nigiri.,"['nigiri', 'rel', 'piec', 'good', 'never', 'eat']","['nigiri', 'rel', 'piec', 'good', 'never', 'eat']",food
"Given the incredible architecture surrounding it, this place has no character.","['architectur', 'charact', 'give', 'incred', 'surround', 'place']","['architectur', 'charact', 'give', 'incred', 'surround', 'place']",ambience
I'd call it an 'italian dinner'.,"['dinner', 'italian', 'call']","['dinner', 'italian', 'call']",anecdotes/miscellaneous
my first time here was with my gf for our 12 month anniversary.,"['time', 'month', 'first', 'anniversari', 'gf']","['time', 'month', 'first', 'anniversari', 'gf']",anecdotes/miscellaneous
"While the place is not a hotspot hangout, the drinks are unique and pack a lot of bang for the buck.","['uniqu', 'bang', 'hangout', 'buck', 'lot', 'drink', 'hotspot', 'place', 'pack']","['uniqu', 'bang', 'hangout', 'buck', 'lot', 'drink', 'hotspot', 'place', 'pack']",food
I have walked by this place for eons and finally went thanks to a girls' night.,"['eon', 'thank', 'go', 'night', 'final', 'girl', 'place', 'walk']","['eon', 'thank', 'go', 'night', 'final', 'girl', 'place', 'walk']",anecdotes/miscellaneous
Have frequented 'ino for several years and the food remains excellent.,"['year', 'remain', 'excel', 'sever', 'frequent', 'food', 'ino']","['year', 'remain', 'excel', 'sever', 'frequent', 'food', 'ino']",food
"Their eggplant is so delicate, sweet tender!","['tender', 'eggplant', 'delic', 'sweet']","['tender', 'eggplant', 'delic', 'sweet']",food
I pray it stays open forever.,"['open', 'pray', 'stay', 'forev']","['open', 'pray', 'stay', 'forev']",anecdotes/miscellaneous
"Each bite of food at Kai was indeed delicious, fresh, and elegant.","['fresh', 'eleg', 'inde', 'delici', 'kai', 'bite', 'food']","['fresh', 'eleg', 'inde', 'delici', 'kai', 'bite', 'food']",food
all the food was excellent - considering the quality of food in most moderately priced restaurants is mediocre this was slightly more pricey and well worth it.,"['slightli', 'restaur', 'qualiti', 'excel', 'consid', 'well', 'mediocr', 'pricey', 'worth', 'food', 'price', 'moder']","['slightli', 'restaur', 'qualiti', 'excel', 'consid', 'well', 'mediocr', 'pricey', 'worth', 'food', 'price', 'moder']",food
"If you want to save some money, don't go here.","['money', 'want', 'go', 'save']","['money', 'want', 'go', 'save']",price
My friend got the mushroom pizza which tasted better.,"['mushroom', 'get', 'friend', 'better', 'pizza', 'tast']","['mushroom', 'get', 'friend', 'better', 'pizza', 'tast']",food
"I had the cod with paella (spicy and very filling, I'm a big eater and could only eat half) while my boyfriend had the classic fish and chips (again, a big serving - at least 5 pieces of fish and a basketful of fries).","['basket', 'half', 'spici', 'could', 'boyfriend', 'fish', 'serv', 'paella', 'chip', 'fri', 'eater', 'least', 'classic', 'cod', 'piec', 'fill', 'big', 'eat']","['basket', 'half', 'spici', 'could', 'boyfriend', 'fish', 'serv', 'paella', 'chip', 'fri', 'eater', 'least', 'classic', 'cod', 'piec', 'fill', 'big', 'eat']",food
"It's a shame that a nice, convenient place like the Pink Pony can be so ruined by lousy service.","['like', 'lousi', 'ruin', 'nice', 'servic', 'pink', 'poni', 'shame', 'conveni', 'place']","['like', 'lousi', 'ruin', 'nice', 'servic', 'pink', 'poni', 'shame', 'conveni', 'place']",service
This is the first time Citysearch did't call it right.,"['time', 'first', 'citysearch', 'right', 'call']","['time', 'first', 'citysearch', 'right', 'call']",anecdotes/miscellaneous
You should pass on the calamari.,"['pass', 'calamari']","['pass', 'calamari']",food
"The porcini mushroom pasta special was tasteless, so was the seafood tagliatelle.","['mushroom', 'pasta', 'tagliatel', 'porcini', 'tasteless', 'seafood', 'special']","['mushroom', 'pasta', 'tagliatel', 'porcini', 'tasteless', 'seafood', 'special']",food
Try the spicy wontons and the salt pepper shrimps.,"['spici', 'shrimp', 'salt', 'wonton', 'tri', 'pepper']","['spici', 'shrimp', 'salt', 'wonton', 'tri', 'pepper']",food
THE FOOD PORTIONS ARE REALLY LARGE.,"['portion', 'larg', 'food', 'realli']","['portion', 'larg', 'food', 'realli']",food
The fries are yummy.,"['fri', 'yummi']","['fri', 'yummi']",food
"Friendly and informative staff, very attentive and prompt raw bar service.","['raw', 'staff', 'prompt', 'bar', 'servic', 'attent', 'friendli', 'inform']","['raw', 'staff', 'prompt', 'bar', 'servic', 'attent', 'friendli', 'inform']",service
Best Taiwanese food in NY!,"['taiwanes', 'food', 'ny', 'best']","['taiwanes', 'food', 'ny', 'best']",food
I have eaten at many pizza places around NYC and this is hands down the worst.,"['hand', 'worst', 'place', 'mani', 'nyc', 'around', 'eat', 'pizza']","['hand', 'worst', 'place', 'mani', 'nyc', 'around', 'eat', 'pizza']",anecdotes/miscellaneous
This place is a great stop for great food.,"['stop', 'food', 'place', 'great']","['stop', 'food', 'place', 'great']",food
All the pastas are fantastic and the homemade lasagna is some of the best that I have had in the City.,"['best', 'pasta', 'lasagna', 'citi', 'fantast', 'homemad']","['best', 'pasta', 'lasagna', 'citi', 'fantast', 'homemad']",food
What for?,[],[],anecdotes/miscellaneous
Fantastic!,['fantast'],['fantast'],anecdotes/miscellaneous
"they were dry and disgusting, i didn't even finish my first piece.","['finish', 'dri', 'first', 'piec', 'even', 'disgust']","['finish', 'dri', 'first', 'piec', 'even', 'disgust']",food
HIGHLY RECOMMENDED for a first date.,"['date', 'first', 'highli', 'recommend']","['date', 'first', 'highli', 'recommend']",anecdotes/miscellaneous
"We laughed when he finally offered us a dessert menu and we left a 10 percent tip, which was generous, I feel.","['laugh', 'leav', 'percent', 'feel', 'tip', 'dessert', 'menu', 'offer', 'gener', 'us', 'final']","['laugh', 'leav', 'percent', 'feel', 'tip', 'dessert', 'menu', 'offer', 'gener', 'us', 'final']",service
And the prices were way to high for what you get.,"['high', 'get', 'price', 'way']","['high', 'get', 'price', 'way']",price
"But people from Sichuan will die for it)  - Chongqing Hot Pot, chongqing was the biggest city of Sichuan, now became an independent province.","['hot', 'sichuan', 'independ', 'peopl', 'becom', 'biggest', 'provinc', 'citi', 'die', 'chongq', 'pot']","['hot', 'sichuan', 'independ', 'peopl', 'becom', 'biggest', 'provinc', 'citi', 'die', 'chongq', 'pot']",anecdotes/miscellaneous
"Skip Baroanda down the street (Eurotrashy, snooty and expensive) and check this place out!","['skip', 'eurotrashi', 'check', 'snooti', 'baroanda', 'street', 'place', 'expens']","['skip', 'eurotrashi', 'check', 'snooti', 'baroanda', 'street', 'place', 'expens']",anecdotes/miscellaneous
Skip this location and go to the one in Soho.,"['skip', 'one', 'locat', 'soho', 'go']","['skip', 'one', 'locat', 'soho', 'go']",anecdotes/miscellaneous
The staff ignored my friends and I the entire time we were there.,"['time', 'staff', 'friend', 'ignor', 'entir']","['time', 'staff', 'friend', 'ignor', 'entir']",service
"Yet paired with such rude service, would never recommend for anyone interested in carrying any kind of conversation while there.","['anyon', 'carri', 'yet', 'pair', 'convers', 'rude', 'recommend', 'interest', 'servic', 'would', 'never', 'kind']","['anyon', 'carri', 'yet', 'pair', 'convers', 'rude', 'recommend', 'interest', 'servic', 'would', 'never', 'kind']",service
"I went to Areo on a Sunday afternoon with four of my girlfriends, and spent three enjoyable hours there.","['spend', 'three', 'enjoy', 'hour', 'sunday', 'four', 'girlfriend', 'go', 'areo', 'afternoon']","['spend', 'three', 'enjoy', 'hour', 'sunday', 'four', 'girlfriend', 'go', 'areo', 'afternoon']",anecdotes/miscellaneous
"The in-house lady DJ on Saturday nights has outrageously good taste in music, and moreover, takes requests.","['ladi', 'dj', 'outrag', 'hous', 'request', 'night', 'moreov', 'music', 'good', 'saturday', 'take', 'tast']","['ladi', 'dj', 'outrag', 'hous', 'request', 'night', 'moreov', 'music', 'good', 'saturday', 'take', 'tast']",ambience
"I need at least three rolls to be full, and that's at least $14.00!","['need', 'three', 'full', 'least', 'roll']","['need', 'three', 'full', 'least', 'roll']",price
Anyone who ever dined at a thai restaurant is in for a huge disappointment.,"['anyon', 'disappoint', 'restaur', 'ever', 'huge', 'din', 'thai']","['anyon', 'disappoint', 'restaur', 'ever', 'huge', 'din', 'thai']",anecdotes/miscellaneous
"All of it was simply amazing, unique and tasty and best of all it didn't break the bank.","['uniqu', 'best', 'break', 'amaz', 'simpli', 'bank', 'tasti']","['uniqu', 'best', 'break', 'amaz', 'simpli', 'bank', 'tasti']",food
"Great wine list, reasonably priced.--Sara","['list', 'reason', 'price', 'sara', 'wine', 'great']","['list', 'reason', 'price', 'sara', 'wine', 'great']",food
The hot dogs were cold in the middle and the buns were stale.,"['hot', 'dog', 'cold', 'stale', 'bun', 'middl']","['hot', 'dog', 'cold', 'stale', 'bun', 'middl']",food
"While the food was excellent, it wasn't cheap (though not extremely expensive either).","['excel', 'though', 'extrem', 'either', 'cheap', 'food', 'expens']","['excel', 'though', 'extrem', 'either', 'cheap', 'food', 'expens']",food
Beef noodle soup is good as well.,"['beef', 'well', 'soup', 'good', 'noodl']","['beef', 'well', 'soup', 'good', 'noodl']",food
I was so sad to read the bad reviews this place got!,"['get', 'bad', 'read', 'place', 'review', 'sad']","['get', 'bad', 'read', 'place', 'review', 'sad']",anecdotes/miscellaneous
Delivery service is great too.,"['deliveri', 'servic', 'great']","['deliveri', 'servic', 'great']",service
"The food's dazzling flavors overwhelm the palate, truly embracing the beauty of authentic Thai cuisine.","['authent', 'cuisin', 'embrac', 'beauti', 'overwhelm', 'truli', 'palat', 'flavor', 'thai', 'food', 'dazzl']","['authent', 'cuisin', 'embrac', 'beauti', 'overwhelm', 'truli', 'palat', 'flavor', 'thai', 'food', 'dazzl']",food
I recieved prompt service with a smile.,"['reciev', 'prompt', 'servic', 'smile']","['reciev', 'prompt', 'servic', 'smile']",service
They pray to their Food Gods to make them into a good pizza like VT's.,"['like', 'vt', 'pizza', 'make', 'good', 'god', 'food', 'pray']","['like', 'vt', 'pizza', 'make', 'good', 'god', 'food', 'pray']",food
The place was quiet and delightful.,"['delight', 'place', 'quiet']","['delight', 'place', 'quiet']",ambience
Molto bene!,"['bene', 'molto']","['bene', 'molto']",anecdotes/miscellaneous
.the best I've found outside of the Chinatown masters.,"['find', 'outsid', 'best', 'chinatown', 'master']","['find', 'outsid', 'best', 'chinatown', 'master']",food
They are amazing!,['amaz'],['amaz'],anecdotes/miscellaneous
Avoid this place!,"['place', 'avoid']","['place', 'avoid']",anecdotes/miscellaneous
The food is a diamond in rough -- the food is delicious and homemade with the perfect balance of herbs and tomatoes.,"['diamond', 'delici', 'tomato', 'perfect', 'herb', 'balanc', 'food', 'homemad', 'rough']","['diamond', 'delici', 'tomato', 'perfect', 'herb', 'balanc', 'food', 'homemad', 'rough']",food
A must try!,"['tri', 'must']","['tri', 'must']",anecdotes/miscellaneous
"As much as I like the food there, I can't bring myself to go back.","['like', 'back', 'much', 'bring', 'go', 'food']","['like', 'back', 'much', 'bring', 'go', 'food']",anecdotes/miscellaneous
It looked like shredded cheese partly done - still in strips.,"['like', 'chees', 'strip', 'do', 'partli', 'look', 'still', 'shred']","['like', 'chees', 'strip', 'do', 'partli', 'look', 'still', 'shred']",food
The prices and ambience are especially great considering it's in the West Village.,"['consid', 'especi', 'west', 'villag', 'price', 'ambienc', 'great']","['consid', 'especi', 'west', 'villag', 'price', 'ambienc', 'great']",ambience
The soup is pretty good too.,"['soup', 'pretti', 'good']","['soup', 'pretti', 'good']",food
It is so easy to get a reservation at a top place in NYC with a week's notice.,"['get', 'reserv', 'week', 'top', 'nyc', 'easi', 'place', 'notic']","['get', 'reserv', 'week', 'top', 'nyc', 'easi', 'place', 'notic']",anecdotes/miscellaneous
I have never better enjoyed humble root vegetables or a mushroom consomme - and this chef accomplishes without fats.,"['mushroom', 'chef', 'without', 'consomm', 'root', 'enjoy', 'humbl', 'better', 'accomplish', 'never', 'fat', 'veget']","['mushroom', 'chef', 'without', 'consomm', 'root', 'enjoy', 'humbl', 'better', 'accomplish', 'never', 'fat', 'veget']",food
"If you go to Roth's try to be served by Mike, he is GREAT!!","['serv', 'mike', 'roth', 'tri', 'go', 'great']","['serv', 'mike', 'roth', 'tri', 'go', 'great']",service
"Based on a visit a month ago, I returned the week before Christmas and was hugely disappointed.","['disappoint', 'month', 'christma', 'visit', 'huge', 'week', 'return', 'base', 'ago']","['disappoint', 'month', 'christma', 'visit', 'huge', 'week', 'return', 'base', 'ago']",anecdotes/miscellaneous
Went here on a friend's reccomendation.,"['friend', 'go', 'reccomend']","['friend', 'go', 'reccomend']",anecdotes/miscellaneous
"not the food ,not the ambiance , not the service, I agree with the previous reviews you wait and wait , the wait staff are very rude and when you get in they are looking to get you right out .","['get', 'ambianc', 'agre', 'previou', 'staff', 'rude', 'servic', 'wait', 'look', 'food', 'right', 'review']","['get', 'ambianc', 'agre', 'previou', 'staff', 'rude', 'servic', 'wait', 'look', 'food', 'right', 'review']",service
"I love Ess-a-bagel, but I live on the west side, so I often go to Murray's for convenience.","['murray', 'live', 'ess', 'bagel', 'conveni', 'west', 'go', 'love', 'often', 'side']","['murray', 'live', 'ess', 'bagel', 'conveni', 'west', 'go', 'love', 'often', 'side']",anecdotes/miscellaneous
I always get the Shabu-Shabu dinner and the beef is always fresh.,"['fresh', 'get', 'shabu', 'beef', 'dinner', 'alway']","['fresh', 'get', 'shabu', 'beef', 'dinner', 'alway']",food
The pizza was delivered cold and the cheese wasn't even fully melted!,"['cold', 'chees', 'deliv', 'melt', 'even', 'fulli', 'pizza']","['cold', 'chees', 'deliv', 'melt', 'even', 'fulli', 'pizza']",food
We were very surprised by how good the food was on our first visit here on a Sunday night.,"['surpris', 'visit', 'first', 'night', 'sunday', 'good', 'food']","['surpris', 'visit', 'first', 'night', 'sunday', 'good', 'food']",food
"Nha Trang, while being notorious for utter lack of comfort and decor, horribly slow wait staff and horribly quick meals, is one of the best vietnamese restaurants i've ever been to. the pho is delicious and comes with very fresh vegtables.","['restaur', 'staff', 'utter', 'vietnames', 'trang', 'come', 'nha', 'slow', 'wait', 'notori', 'delici', 'horribl', 'pho', 'vegtabl', 'quick', 'fresh', 'decor', 'best', 'lack', 'ever', 'one', 'meal', 'comfort']","['restaur', 'staff', 'utter', 'vietnames', 'trang', 'come', 'nha', 'slow', 'wait', 'notori', 'delici', 'horribl', 'pho', 'vegtabl', 'quick', 'fresh', 'decor', 'best', 'lack', 'ever', 'one', 'meal', 'comfort']",food
"On the other hand, if you are not fooled easily, you will find hundreds of restaurants that will give you service and ambiance that is on par with Alain Ducasse, and food that will outshine in presentaion, taste, choice, quality and quantity.","['hand', 'easili', 'find', 'ambianc', 'restaur', 'food', 'qualiti', 'quantiti', 'choic', 'outshin', 'give', 'presentaion', 'servic', 'tast', 'alain', 'ducass', 'hundr', 'par', 'fool']","['hand', 'easili', 'find', 'ambianc', 'restaur', 'food', 'qualiti', 'quantiti', 'choic', 'outshin', 'give', 'presentaion', 'servic', 'tast', 'alain', 'ducass', 'hundr', 'par', 'fool']",food
We will definitely go back.,"['go', 'back', 'definit']","['go', 'back', 'definit']",anecdotes/miscellaneous
I live in the neighborhood and my friends meet me down here not only for the bar scene but also the promise of The Pizza Place at 3am.,"['meet', 'neighborhood', 'also', 'live', 'friend', 'scene', 'bar', 'place', 'pizza', 'promis']","['meet', 'neighborhood', 'also', 'live', 'friend', 'scene', 'bar', 'place', 'pizza', 'promis']",anecdotes/miscellaneous
Is just the way it was in days gone by.,"['day', 'go', 'way']","['day', 'go', 'way']",anecdotes/miscellaneous
"If I could rate the people this place would be off the charts - unfortunately - the pizza, sorry - not the best in NYC.","['could', 'best', 'peopl', 'sorri', 'chart', 'would', 'nyc', 'place', 'pizza', 'rate', 'unfortun']","['could', 'best', 'peopl', 'sorri', 'chart', 'would', 'nyc', 'place', 'pizza', 'rate', 'unfortun']",food
The food is amazing!!!!,"['food', 'amaz']","['food', 'amaz']",food
"Having not been home in the last 2 years may skew this reviewer a bit, but the food was tasty and spicy sans the oil that comes floating along at similar venues.","['may', 'come', 'food', 'spici', 'along', 'year', 'float', 'similar', 'san', 'home', 'last', 'oil', 'skew', 'venu', 'bite', 'review', 'tasti']","['may', 'come', 'food', 'spici', 'along', 'year', 'float', 'similar', 'san', 'home', 'last', 'oil', 'skew', 'venu', 'bite', 'review', 'tasti']",food
"The portions are now very small, the sauces are overly-ambitious usually inedible while the service is still good, the restaurant, due to its popularity, seems frantic.","['small', 'usual', 'restaur', 'frantic', 'ambiti', 'seem', 'servic', 'due', 'good', 'overli', 'sauc', 'still', 'portion', 'ined', 'popular']","['small', 'usual', 'restaur', 'frantic', 'ambiti', 'seem', 'servic', 'due', 'good', 'overli', 'sauc', 'still', 'portion', 'ined', 'popular']",food
"For the price, you cannot eat this well in Manhattan.","['manhattan', 'well', 'eat', 'price', 'cannot']","['manhattan', 'well', 'eat', 'price', 'cannot']",price
"The owner is very friendly and a great guy, go try his pizza, you'll like it!","['like', 'pizza', 'owner', 'tri', 'friendli', 'go', 'guy', 'great']","['like', 'pizza', 'owner', 'tri', 'friendli', 'go', 'guy', 'great']",service
The atmosphere is great!!!,"['atmospher', 'great']","['atmospher', 'great']",ambience
"It can be a very fun experience with a group, and kids (6 and over) would love it.","['would', 'group', 'kid', 'love', 'fun', 'experi']","['would', 'group', 'kid', 'love', 'fun', 'experi']",ambience
"With so many good restaurants on the UWS, I don't need overpriced food, absurdly arrogant wait-staff who don't recognize they work at a glorified diner, clumsy service, and management that doesn't care.","['restaur', 'recogn', 'uw', 'manag', 'staff', 'need', 'glorifi', 'overpric', 'absurdli', 'servic', 'mani', 'good', 'wait', 'diner', 'work', 'care', 'food', 'arrog', 'clumsi']","['restaur', 'recogn', 'uw', 'manag', 'staff', 'need', 'glorifi', 'overpric', 'absurdli', 'servic', 'mani', 'good', 'wait', 'diner', 'work', 'care', 'food', 'arrog', 'clumsi']",service
