reviews,lemmas,lemmas,aspectCategory
And their prices are very high - they actually think that they can get away with charging such prices for such terrible food and service!,"['get', 'actual', 'terribl', 'think', 'high', 'away', 'servic', 'food', 'price', 'charg']","['get', 'actual', 'terribl', 'think', 'high', 'away', 'servic', 'food', 'price', 'charg']",food
They're terrific!!,['terrif'],['terrif'],anecdotes/miscellaneous
"The service was excellent, the food was excellent, but the entire experience was very cool.","['excel', 'servic', 'cool', 'food', 'experi', 'entir']","['excel', 'servic', 'cool', 'food', 'experi', 'entir']",food
The service is good and the resturant is clean.,"['restur', 'servic', 'clean', 'good']","['restur', 'servic', 'clean', 'good']",service
"Great spot, whether looking for a couple of drinks or quiet dinner.","['whether', 'coupl', 'great', 'dinner', 'quiet', 'drink', 'look', 'spot']","['whether', 'coupl', 'great', 'dinner', 'quiet', 'drink', 'look', 'spot']",ambience
Just stick with the small dishes!,"['small', 'stick', 'dish']","['small', 'stick', 'dish']",food
"The cafe itself was really nice with comfortable outdoor chairs and tables, but the service could have been better.","['tabl', 'could', 'nice', 'comfort', 'outdoor', 'cafe', 'servic', 'realli', 'chair', 'better']","['tabl', 'could', 'nice', 'comfort', 'outdoor', 'cafe', 'servic', 'realli', 'chair', 'better']",service
I've rarely had a problem with slow staff in the 10 years I've been going.,"['year', 'staff', 'slow', 'problem', 'go', 'rare']","['year', 'staff', 'slow', 'problem', 'go', 'rare']",service
Food is excellent.,"['excel', 'food']","['excel', 'food']",food
"This place is a literal hole-in-the-wall that is buried within Doyers, right off of Pell St (barber's alley) in Chinatown.","['wall', 'buri', 'within', 'pell', 'alley', 'place', 'st', 'liter', 'chinatown', 'barber', 'hole', 'right', 'doyer']","['wall', 'buri', 'within', 'pell', 'alley', 'place', 'st', 'liter', 'chinatown', 'barber', 'hole', 'right', 'doyer']",ambience
They outshine HH.,"['hh', 'outshin']","['hh', 'outshin']",anecdotes/miscellaneous
Although we were looking for regular lettuce and some walnuts the salads we got were great.,"['get', 'regular', 'salad', 'lettuc', 'walnut', 'look', 'although', 'great']","['get', 'regular', 'salad', 'lettuc', 'walnut', 'look', 'although', 'great']",food
Excellent lunch buffet for only $6.95.,"['excel', 'lunch', 'buffet']","['excel', 'lunch', 'buffet']",food
We were sorry to check them off our list as we had enjoyed and recommended the place in the past.,"['list', 'sorri', 'check', 'recommend', 'enjoy', 'place', 'past']","['list', 'sorri', 'check', 'recommend', 'enjoy', 'place', 'past']",anecdotes/miscellaneous
"If you're not familiar with the cuisine, you may encounter problems ordering here and be sure to bring plenty of cash with you as they don't accept credit cards.","['may', 'card', 'order', 'familiar', 'cuisin', 'credit', 'bring', 'accept', 'cash', 'problem', 'encount', 'plenti', 'sure']","['may', 'card', 'order', 'familiar', 'cuisin', 'credit', 'bring', 'accept', 'cash', 'problem', 'encount', 'plenti', 'sure']",anecdotes/miscellaneous
"both are very reasonably priced (around $8 for dinner and $5 for lunch), and are delicious and filling.","['delici', 'reason', 'dinner', 'fill', 'around', 'lunch', 'price']","['delici', 'reason', 'dinner', 'fill', 'around', 'lunch', 'price']",food
Problem is nothing at Prune is particularly memorable.,"['memor', 'noth', 'prune', 'particularli', 'problem']","['memor', 'noth', 'prune', 'particularli', 'problem']",anecdotes/miscellaneous
"Ambience is so cute and quaint, good for business although we were there on vacation.","['cute', 'busi', 'quaint', 'good', 'vacat', 'although', 'ambienc']","['cute', 'busi', 'quaint', 'good', 'vacat', 'although', 'ambienc']",ambience
"The portion sizes here are huge, and the sushi is good.","['sushi', 'huge', 'size', 'good', 'portion']","['sushi', 'huge', 'size', 'good', 'portion']",food
Just wish they'd expand.,"['expand', 'wish']","['expand', 'wish']",anecdotes/miscellaneous
My boyfriend ate tuna and it was cooked perfectly!,"['boyfriend', 'perfectli', 'eat', 'tuna', 'cook']","['boyfriend', 'perfectli', 'eat', 'tuna', 'cook']",food
"This wasn't the expected menu comprised only of pad thai and tom yum soup, but I thought that was what made the place so special.","['think', 'yum', 'soup', 'menu', 'compris', 'make', 'expect', 'special', 'pad', 'thai', 'place', 'tom']","['think', 'yum', 'soup', 'menu', 'compris', 'make', 'expect', 'special', 'pad', 'thai', 'place', 'tom']",food
"Good food at the restaurant (a bit expensive, but great if you want to impress your date).","['food', 'great', 'restaur', 'date', 'want', 'impress', 'good', 'bite', 'expens']","['food', 'great', 'restaur', 'date', 'want', 'impress', 'good', 'bite', 'expens']",food
I highly recommend Caviar Russe to anyone who wants delicious top grade caviar and fantastic service.,"['anyon', 'grade', 'want', 'russ', 'recommend', 'fantast', 'top', 'caviar', 'servic', 'delici', 'highli']","['anyon', 'grade', 'want', 'russ', 'recommend', 'fantast', 'top', 'caviar', 'servic', 'delici', 'highli']",food
You can't say its cheap because food is cheaper in Chinatown.,"['cheaper', 'say', 'chinatown', 'cheap', 'food']","['cheaper', 'say', 'chinatown', 'cheap', 'food']",price
I have eaten there 3-4 times and the food was always good.,"['time', 'eat', 'alway', 'good', 'food']","['time', 'eat', 'alway', 'good', 'food']",food
keep up the good work.,"['work', 'keep', 'good']","['work', 'keep', 'good']",anecdotes/miscellaneous
"I wasn't thrilled to have to wait on line for thirty minutes, but I guess that's the price you pay for a popular place.","['thirti', 'minut', 'pay', 'price', 'wait', 'line', 'place', 'thrill', 'popular', 'guess']","['thirti', 'minut', 'pay', 'price', 'wait', 'line', 'place', 'thrill', 'popular', 'guess']",anecdotes/miscellaneous
"great eats, good times.","['time', 'eat', 'good', 'great']","['time', 'eat', 'good', 'great']",anecdotes/miscellaneous
Make sure you try this place as often as you can.,"['make', 'tri', 'place', 'often', 'sure']","['make', 'tri', 'place', 'often', 'sure']",anecdotes/miscellaneous
"Grilled whole fish wonderful, great spicing.","['whole', 'wonder', 'spice', 'fish', 'grill', 'great']","['whole', 'wonder', 'spice', 'fish', 'grill', 'great']",food
"For years, I thought Tuscan cuisine was the best, but Salvatore converted me to the hearty Neapolitan fare on my first visit.","['best', 'think', 'year', 'cuisin', 'first', 'visit', 'tuscan', 'hearti', 'salvator', 'convert', 'fare', 'neapolitan']","['best', 'think', 'year', 'cuisin', 'first', 'visit', 'tuscan', 'hearti', 'salvator', 'convert', 'fare', 'neapolitan']",food
"Plus, when our entrees were held up in the kitchen on a busy Saturday night, the owner sent over complimentary summer rolls to hold us over!","['busi', 'owner', 'complimentari', 'us', 'send', 'plu', 'night', 'hold', 'kitchen', 'saturday', 'entre', 'roll', 'summer']","['busi', 'owner', 'complimentari', 'us', 'send', 'plu', 'night', 'hold', 'kitchen', 'saturday', 'entre', 'roll', 'summer']",service
The service was great as well.,"['servic', 'well', 'great']","['servic', 'well', 'great']",service
Try the lobster teriyaki and the rose special roll.,"['rise', 'teriyaki', 'special', 'lobster', 'tri', 'roll']","['rise', 'teriyaki', 'special', 'lobster', 'tri', 'roll']",food
Another plus is most of the entrees are approx.,"['plu', 'anoth', 'approx', 'entre']","['plu', 'anoth', 'approx', 'entre']",anecdotes/miscellaneous
I will go back to Suan soon!,"['go', 'back', 'suan', 'soon']","['go', 'back', 'suan', 'soon']",anecdotes/miscellaneous
Loved it!,['love'],['love'],anecdotes/miscellaneous
"The food was delicious, the atmosphere was relaxed, and we have now adopted Plate 347 as our Secret on Second!","['adopt', 'delici', 'atmospher', 'relax', 'second', 'food', 'plate', 'secret']","['adopt', 'delici', 'atmospher', 'relax', 'second', 'food', 'plate', 'secret']",food
We were pleasantly surprised.,"['pleasantli', 'surpris']","['pleasantli', 'surpris']",anecdotes/miscellaneous
From the moment we walked in they were more than accomodating even though the place was packed.,"['though', 'accomod', 'moment', 'even', 'place', 'pack', 'walk']","['though', 'accomod', 'moment', 'even', 'place', 'pack', 'walk']",service
"It is LOUD, HOT and DARK.","['hot', 'loud', 'dark']","['hot', 'loud', 'dark']",ambience
"I found the food, service and value exceptional everytime I have been there.","['find', 'servic', 'except', 'valu', 'everytim', 'food']","['find', 'servic', 'except', 'valu', 'everytim', 'food']",food
We ate at this Thai place following the reviews but very unhappy with the foods.,"['food', 'place', 'follow', 'unhappi', 'thai', 'eat', 'review']","['food', 'place', 'follow', 'unhappi', 'thai', 'eat', 'review']",anecdotes/miscellaneous
"The food is definitely good, but I left a bit disappointed.","['disappoint', 'food', 'leav', 'good', 'definit', 'bite']","['disappoint', 'food', 'leav', 'good', 'definit', 'bite']",food
"I am a 100 lb girl, had a glass of wine and a glass of beer prior to the dinner, and I was still HUNGRY after my visit to this place!","['still', 'visit', 'beer', 'prior', 'dinner', 'hungri', 'girl', 'glass', 'place', 'wine', 'lb']","['still', 'visit', 'beer', 'prior', 'dinner', 'hungri', 'girl', 'glass', 'place', 'wine', 'lb']",anecdotes/miscellaneous
"The drinks are a saving grace, but service staff, please, get over yourselves.","['get', 'grace', 'staff', 'pleas', 'servic', 'drink', 'save']","['get', 'grace', 'staff', 'pleas', 'servic', 'drink', 'save']",food
It was wonderful.,['wonder'],['wonder'],anecdotes/miscellaneous
There is a downside if you're ordering in -- the delivery guys have MAJOR attitude.,"['order', 'attitud', 'major', 'downsid', 'deliveri', 'guy']","['order', 'attitud', 'major', 'downsid', 'deliveri', 'guy']",service
Will give it another chance before I write it off.,"['write', 'anoth', 'chanc', 'give']","['write', 'anoth', 'chanc', 'give']",anecdotes/miscellaneous
The all-Italian staff is warm and engaging from the start.,"['staff', 'start', 'engag', 'warm', 'italian']","['staff', 'start', 'engag', 'warm', 'italian']",service
Village is one of those places that scores on all fronts.,"['place', 'front', 'one', 'score', 'villag']","['place', 'front', 'one', 'score', 'villag']",anecdotes/miscellaneous
The prices are exceptionally reasonable for food of this caliber.,"['calib', 'reason', 'except', 'food', 'price']","['calib', 'reason', 'except', 'food', 'price']",price
If you go here - your focus should be the Tamarind Margaritas.,"['focu', 'margarita', 'go', 'tamarind']","['focu', 'margarita', 'go', 'tamarind']",food
It is the best hidden spot there and I rave about it to everyone.,"['best', 'hide', 'rave', 'everyon', 'spot']","['best', 'hide', 'rave', 'everyon', 'spot']",anecdotes/miscellaneous
The filet mignon dish was superb!,"['filet', 'dish', 'mignon', 'superb']","['filet', 'dish', 'mignon', 'superb']",food
I had been a regular due to the consistently good food and ease of getting a table.,"['tabl', 'get', 'regular', 'consist', 'eas', 'due', 'good', 'food']","['tabl', 'get', 'regular', 'consist', 'eas', 'due', 'good', 'food']",anecdotes/miscellaneous
Can't wait wait for my next visit.,"['visit', 'wait', 'next']","['visit', 'wait', 'next']",anecdotes/miscellaneous
This place is the most Japanese it can ever get.,"['ever', 'place', 'get', 'japanes']","['ever', 'place', 'get', 'japanes']",ambience
"The food is good, I can't lie.","['food', 'good', 'lie']","['food', 'good', 'lie']",food
"great food, lt's of it, more then one person can eat!","['food', 'one', 'eat', 'lt', 'person', 'great']","['food', 'one', 'eat', 'lt', 'person', 'great']",food
"I didn't expect to like Nosh as much as I did, but the pastrami on challah sandwich I had was otherworldly, the soups are like Mom's, and the knishes give Yonah Schimmel's a run for its money.","['nosh', 'like', 'schimmel', 'challah', 'money', 'knish', 'much', 'otherworldli', 'give', 'sandwich', 'soup', 'expect', 'run', 'pastrami', 'yonah', 'mom']","['nosh', 'like', 'schimmel', 'challah', 'money', 'knish', 'much', 'otherworldli', 'give', 'sandwich', 'soup', 'expect', 'run', 'pastrami', 'yonah', 'mom']",food
"The atmosphere is nothing special, but it feels like a Sushi establishment in Tokyo.","['like', 'sushi', 'atmospher', 'noth', 'feel', 'establish', 'special', 'tokyo']","['like', 'sushi', 'atmospher', 'noth', 'feel', 'establish', 'special', 'tokyo']",ambience
Cozy romantic atomosphere with only around 15 tables at most.,"['tabl', 'atomospher', 'cozi', 'around', 'romant']","['tabl', 'atomospher', 'cozi', 'around', 'romant']",ambience
This place is worth going even if only for their beer.,"['beer', 'go', 'even', 'worth', 'place']","['beer', 'go', 'even', 'worth', 'place']",food
I really like both the scallops and the mahi mahi (on saffron risotto-yum!).,"['like', 'scallop', 'yum', 'saffron', 'mahi', 'realli', 'risotto']","['like', 'scallop', 'yum', 'saffron', 'mahi', 'realli', 'risotto']",food
"The ambience was so fun, and the prices were great, on top of the fact that the food was really tasty.","['tasti', 'fact', 'top', 'realli', 'food', 'price', 'fun', 'ambienc', 'great']","['tasti', 'fact', 'top', 'realli', 'food', 'price', 'fun', 'ambienc', 'great']",food
"Do not get the Go Go Hamburgers, no matter what the reviews say.","['get', 'hamburg', 'matter', 'say', 'go', 'review']","['get', 'hamburg', 'matter', 'say', 'go', 'review']",food
The sandwhiches are out-of-this world!,"['sandwhich', 'world']","['sandwhich', 'world']",food
"If you live in Upper Manhattan, Siam Square is THE place for Thia food.","['thia', 'squar', 'manhattan', 'food', 'live', 'siam', 'upper', 'place']","['thia', 'squar', 'manhattan', 'food', 'live', 'siam', 'upper', 'place']",anecdotes/miscellaneous
Decor is charming.,"['decor', 'charm']","['decor', 'charm']",ambience
The food was very well prepared.,"['prepar', 'food', 'well']","['prepar', 'food', 'well']",food
Really tasty spring rolls and noodles for a good price though.,"['though', 'price', 'realli', 'good', 'roll', 'spring', 'noodl', 'tasti']","['though', 'price', 'realli', 'good', 'roll', 'spring', 'noodl', 'tasti']",food
Stay away from this place.,"['away', 'place', 'stay']","['away', 'place', 'stay']",anecdotes/miscellaneous
"Good, because hey, it's more food, but bad because dim sum is supposed to be smaller portions so you can try out more dishes and smaller so that each dish is cheap.","['bad', 'smaller', 'hey', 'portion', 'dish', 'good', 'sum', 'cheap', 'tri', 'suppos', 'food', 'dim']","['bad', 'smaller', 'hey', 'portion', 'dish', 'good', 'sum', 'cheap', 'tri', 'suppos', 'food', 'dim']",food
"While most people can attest to spending over $50 on drinks in New York bars and hardly feeling a thing, the drinks here are plentiful and unique.","['uniqu', 'new', 'spend', 'peopl', 'feel', 'york', 'plenti', 'drink', 'attest', 'bar', 'thing', 'hardli']","['uniqu', 'new', 'spend', 'peopl', 'feel', 'york', 'plenti', 'drink', 'attest', 'bar', 'thing', 'hardli']",food
"Complimentary stuff kept coming, and when the waiter saw me opening a gift, I received my dessert on a plate that had Happy Birthday written on it, with a candlevery nice touch, and attentive staff.","['come', 'waiter', 'happi', 'keep', 'write', 'touch', 'gift', 'staff', 'complimentari', 'nice', 'dessert', 'saw', 'receiv', 'stuff', 'attent', 'birthday', 'open', 'plate', 'candleveri']","['come', 'waiter', 'happi', 'keep', 'write', 'touch', 'gift', 'staff', 'complimentari', 'nice', 'dessert', 'saw', 'receiv', 'stuff', 'attent', 'birthday', 'open', 'plate', 'candleveri']",service
"The food arrived 20 minutes after I called, cold and soggy.","['soggi', 'cold', 'arriv', 'food', 'minut', 'call']","['soggi', 'cold', 'arriv', 'food', 'minut', 'call']",food
"If you go for the pre-theatre menu, it's an even greater deal.","['theatr', 'pre', 'greater', 'menu', 'even', 'go', 'deal']","['theatr', 'pre', 'greater', 'menu', 'even', 'go', 'deal']",price
"The one up front will smile and say What can I get for you, brother?","['get', 'front', 'smile', 'one', 'brother', 'say']","['get', 'front', 'smile', 'one', 'brother', 'say']",service
Brava La Pizza Fresca!,"['brava', 'pizza', 'la', 'fresca']","['brava', 'pizza', 'la', 'fresca']",anecdotes/miscellaneous
"If you are someone who appreciates simplicity, elegance, and wonderfully presented and tasting seafood and vegetables regardless of portion size, Kai is your place.","['eleg', 'present', 'wonder', 'kai', 'place', 'appreci', 'simplic', 'regardless', 'someon', 'size', 'seafood', 'portion', 'veget', 'tast']","['eleg', 'present', 'wonder', 'kai', 'place', 'appreci', 'simplic', 'regardless', 'someon', 'size', 'seafood', 'portion', 'veget', 'tast']",food
"The prices cannot be beat for the quality, quantity, freshness and taste.","['fresh', 'quantiti', 'qualiti', 'beat', 'price', 'cannot', 'tast']","['fresh', 'quantiti', 'qualiti', 'beat', 'price', 'cannot', 'tast']",price
"Check it out, it won't hurt your stomach or your wallet.","['wallet', 'stomach', 'check', 'hurt']","['wallet', 'stomach', 'check', 'hurt']",anecdotes/miscellaneous
"If just to drop in, quickly stuff yourself and jet out -- to keep their turn-over.","['drop', 'keep', 'jet', 'quickli', 'turn', 'stuff']","['drop', 'keep', 'jet', 'quickli', 'turn', 'stuff']",anecdotes/miscellaneous
"Little Tonino's is just awesome, our favorite delivery place in Kennsington, honestly the best Gnochi I have ever had!","['gnochi', 'tonino', 'awesom', 'best', 'honestli', 'ever', 'kennsington', 'littl', 'favorit', 'deliveri', 'place']","['gnochi', 'tonino', 'awesom', 'best', 'honestli', 'ever', 'kennsington', 'littl', 'favorit', 'deliveri', 'place']",food
INCREDIBLY POOR SERVICE AN FOOD QUALITY AT EXORBITANT PRICES.,"['qualiti', 'exorbit', 'poor', 'servic', 'incred', 'food', 'price']","['qualiti', 'exorbit', 'poor', 'servic', 'incred', 'food', 'price']",food
I have been about 4 times and have always had a great meal.,"['time', 'alway', 'meal', 'great']","['time', 'alway', 'meal', 'great']",food
I go back in line like three times on average until I can't walk anymore.,"['time', 'back', 'like', 'averag', 'three', 'line', 'anymor', 'go', 'walk']","['time', 'back', 'like', 'averag', 'three', 'line', 'anymor', 'go', 'walk']",anecdotes/miscellaneous
We usually just get some of the dinner specials and they are very reasonably priced and very tasty.,"['usual', 'get', 'reason', 'dinner', 'special', 'price', 'tasti']","['usual', 'get', 'reason', 'dinner', 'special', 'price', 'tasti']",food
Horrible food and Horrible service.,"['horribl', 'servic', 'food']","['horribl', 'servic', 'food']",food
The wine and cheese plate are plentiful and can't wait to try the fondue or table grilling.,"['tabl', 'plate', 'chees', 'wait', 'plenti', 'fondu', 'grill', 'tri', 'wine']","['tabl', 'plate', 'chees', 'wait', 'plenti', 'fondu', 'grill', 'tri', 'wine']",food
Bleecker St Pizza is the best!,"['pizza', 'bleecker', 'best', 'st']","['pizza', 'bleecker', 'best', 'st']",anecdotes/miscellaneous
I DO NOT RECOMMEND THE HEARTLAND BREWERY.,"['heartland', 'breweri', 'recommend']","['heartland', 'breweri', 'recommend']",anecdotes/miscellaneous
They treated us well and the food was extremely fresh and well-prepared.,"['fresh', 'prepar', 'extrem', 'well', 'us', 'treat', 'food']","['fresh', 'prepar', 'extrem', 'well', 'us', 'treat', 'food']",food
Their exotic salad is basic ly a delcious little green salad with a peanut sauce that is perfect before their sweet basil fried tofu.,"['sweet', 'peanut', 'fri', 'delciou', 'salad', 'perfect', 'tofu', 'littl', 'ly', 'green', 'basic', 'sauc', 'basil', 'exot']","['sweet', 'peanut', 'fri', 'delciou', 'salad', 'perfect', 'tofu', 'littl', 'ly', 'green', 'basic', 'sauc', 'basil', 'exot']",food
THE BIG COMPLAINT: NO TOASTING AVAILABLE.,"['big', 'avail', 'complaint', 'toast']","['big', 'avail', 'complaint', 'toast']",food
"Even if the food wasn't this good, the garden is a great place to sit outside and relax.","['outsid', 'place', 'even', 'garden', 'relax', 'good', 'sit', 'food', 'great']","['outsid', 'place', 'even', 'garden', 'relax', 'good', 'sit', 'food', 'great']",food
"Volare virgins or weekly regulars, everyone gets treated the same and you can't ask for more than that when the service is this friendly.","['get', 'regular', 'virgin', 'servic', 'weekli', 'volar', 'treat', 'friendli', 'everyon', 'ask']","['get', 'regular', 'virgin', 'servic', 'weekli', 'volar', 'treat', 'friendli', 'everyon', 'ask']",service
"The food came out wrong, the waiter was no where to be found and the wine showed up at the end of the meal.","['come', 'find', 'waiter', 'end', 'show', 'meal', 'food', 'wine', 'wrong']","['come', 'find', 'waiter', 'end', 'show', 'meal', 'food', 'wine', 'wrong']",food
"The chicken and steak were seasoned and cooked to perfection, and the lamb sandwhich is great for heartier appetites.","['appetit', 'season', 'great', 'chicken', 'lamb', 'perfect', 'sandwhich', 'steak', 'heartier', 'cook']","['appetit', 'season', 'great', 'chicken', 'lamb', 'perfect', 'sandwhich', 'steak', 'heartier', 'cook']",food
Faan is sooo good.,"['faan', 'good', 'sooo']","['faan', 'good', 'sooo']",anecdotes/miscellaneous
We saw them heating up at least one frozen item though I'm not sure which dim sum dish it was.,"['freez', 'though', 'one', 'saw', 'least', 'dish', 'heat', 'sum', 'item', 'sure', 'dim']","['freez', 'though', 'one', 'saw', 'least', 'dish', 'heat', 'sum', 'item', 'sure', 'dim']",food
No you're going to go back because the food was good.,"['food', 'go', 'back', 'good']","['food', 'go', 'back', 'good']",anecdotes/miscellaneous
The food was great and the service was even better.,"['servic', 'even', 'better', 'food', 'great']","['servic', 'even', 'better', 'food', 'great']",food
"While this can hardly be called a restaurant, it is possibly the best deal in Manhatten: $4 for a plate heaped with rice and 2-3 entrees.","['restaur', 'best', 'rice', 'manhatten', 'entre', 'possibl', 'plate', 'heap', 'deal', 'call', 'hardli']","['restaur', 'best', 'rice', 'manhatten', 'entre', 'possibl', 'plate', 'heap', 'deal', 'call', 'hardli']",ambience
Traditional French decour was pleasant though the hall was rather noisy - the restaurant was full and we had to raise our voices to be able to maintain a conversation.,"['pleasant', 'maintain', 'decour', 'restaur', 'rais', 'tradit', 'though', 'voic', 'full', 'convers', 'abl', 'noisi', 'hall', 'rather', 'french']","['pleasant', 'maintain', 'decour', 'restaur', 'rais', 'tradit', 'though', 'voic', 'full', 'convers', 'abl', 'noisi', 'hall', 'rather', 'french']",ambience
The fish is fresh and each piece is sliced to perfection and seasoned by the sushi chef (usually with a little fresh wasabi and soy sauce but also sometimes with some sea salt).,"['fresh', 'slice', 'season', 'chef', 'usual', 'sushi', 'fish', 'wasabi', 'also', 'perfect', 'piec', 'littl', 'soy', 'sometim', 'salt', 'sauc', 'sea']","['fresh', 'slice', 'season', 'chef', 'usual', 'sushi', 'fish', 'wasabi', 'also', 'perfect', 'piec', 'littl', 'soy', 'sometim', 'salt', 'sauc', 'sea']",food
"Consequently, their burgers fell apart in their hands and made such a mess that they did'nt feel like finishing them.","['hand', 'nt', 'like', 'finish', 'consequ', 'feel', 'fell', 'make', 'apart', 'burger', 'mess']","['hand', 'nt', 'like', 'finish', 'consequ', 'feel', 'fell', 'make', 'apart', 'burger', 'mess']",food
My son and his girlfriend both wanted cheeseburgers and they were huge!,"['cheeseburg', 'want', 'huge', 'son', 'girlfriend']","['cheeseburg', 'want', 'huge', 'son', 'girlfriend']",food
I really recommend the very simple Unda (Egg) rolls.,"['unda', 'recommend', 'egg', 'simpl', 'realli', 'roll']","['unda', 'recommend', 'egg', 'simpl', 'realli', 'roll']",food
I will not be coming here at 3am again.,['come'],['come'],anecdotes/miscellaneous
Unbelievable.,['unbeliev'],['unbeliev'],anecdotes/miscellaneous
Very good wine choices.,"['choic', 'wine', 'good']","['choic', 'wine', 'good']",food
"This is the only Thai place I go too in NYC, it's wonderful, and live relaxed Jazz on certain nights.","['wonder', 'certain', 'live', 'go', 'night', 'relax', 'jazz', 'nyc', 'thai', 'place']","['wonder', 'certain', 'live', 'go', 'night', 'relax', 'jazz', 'nyc', 'thai', 'place']",ambience
We will be back.,['back'],['back'],anecdotes/miscellaneous
We were seated and ignored by waitstaff.,"['ignor', 'waitstaff', 'seat']","['ignor', 'waitstaff', 'seat']",service
"If you are in a big group, this place is perfect because it recomends sharing - they have lazy susans on most tables - even families can feel comfortable here.","['tabl', 'famili', 'feel', 'perfect', 'recomend', 'comfort', 'even', 'group', 'share', 'lazi', 'big', 'place', 'susan']","['tabl', 'famili', 'feel', 'perfect', 'recomend', 'comfort', 'even', 'group', 'share', 'lazi', 'big', 'place', 'susan']",ambience
They showed up 15 minutes after the tuna melt.,"['melt', 'minut', 'tuna', 'show']","['melt', 'minut', 'tuna', 'show']",service
"Tasty steak, pork loin, the works.","['work', 'loin', 'steak', 'pork', 'tasti']","['work', 'loin', 'steak', 'pork', 'tasti']",food
I went with 5 friends and we lingered at the table for a bit and didn't feel rushed at all even though there was a wait.,"['tabl', 'linger', 'feel', 'though', 'friend', 'even', 'rush', 'wait', 'bite', 'go']","['tabl', 'linger', 'feel', 'though', 'friend', 'even', 'rush', 'wait', 'bite', 'go']",anecdotes/miscellaneous
I went to Ruby Foos for my birthday and enjoyed our experience there.,"['foo', 'enjoy', 'birthday', 'go', 'experi', 'rubi']","['foo', 'enjoy', 'birthday', 'go', 'experi', 'rubi']",anecdotes/miscellaneous
