reviews,lemmas,lemmas,aspectCategory
Total hipster-wannabe attitude in an otherwise sweet spot.,"['sweet', 'attitud', 'total', 'otherwis', 'hipster', 'wannab', 'spot']","['sweet', 'attitud', 'total', 'otherwis', 'hipster', 'wannab', 'spot']",service
"Yes, there might be a wait if you have no reservations.","['ye', 'reserv', 'wait', 'might']","['ye', 'reserv', 'wait', 'might']",service
Thank You Emilio.,"['emilio', 'thank']","['emilio', 'thank']",anecdotes/miscellaneous
First of all Dal Bukhara Rocks.,"['dal', 'bukhara', 'first', 'rock']","['dal', 'bukhara', 'first', 'rock']",anecdotes/miscellaneous
"Everything, from the soft bread, soggy salad, and 50 minute wait time, with an incredibly rude service to deliver below average food.","['soggi', 'time', 'bread', 'averag', 'deliv', 'salad', 'soft', 'rude', 'servic', 'everyth', 'wait', 'incred', 'food', 'minut']","['soggi', 'time', 'bread', 'averag', 'deliv', 'salad', 'soft', 'rude', 'servic', 'everyth', 'wait', 'incred', 'food', 'minut']",food
- i asked for them spicy and they were delicious).,"['delici', 'spici', 'ask']","['delici', 'spici', 'ask']",food
"It is terrific, as is the value.","['valu', 'terrif']","['valu', 'terrif']",food
The sicilian is my favorite it is moist not dry like most places but all their pizza is great!,"['moist', 'like', 'dri', 'sicilian', 'favorit', 'place', 'pizza', 'great']","['moist', 'like', 'dri', 'sicilian', 'favorit', 'place', 'pizza', 'great']",food
Downstairs lounge is always a good attraction,"['attract', 'downstair', 'loung', 'alway', 'good']","['attract', 'downstair', 'loung', 'alway', 'good']",ambience
The menu prices are a bit expensive for what you get in quality and portion size.,"['get', 'qualiti', 'portion', 'menu', 'size', 'bite', 'price', 'expens']","['get', 'qualiti', 'portion', 'menu', 'size', 'bite', 'price', 'expens']",price
"The food was amazing, and the service was prompt and helpful, but not over-bearing or rushed.","['prompt', 'amaz', 'servic', 'bear', 'rush', 'help', 'food']","['prompt', 'amaz', 'servic', 'bear', 'rush', 'help', 'food']",food
"(food was delivered by a busboy, not waiter) We got no cheese offered for the pasta, our water and wine glasses remained EMPTY our entire meal, when we would have easily spent another $20 on wine.","['waiter', 'easili', 'get', 'spend', 'water', 'pasta', 'deliv', 'chees', 'busboy', 'remain', 'empti', 'meal', 'anoth', 'would', 'offer', 'glass', 'food', 'wine', 'entir']","['waiter', 'easili', 'get', 'spend', 'water', 'pasta', 'deliv', 'chees', 'busboy', 'remain', 'empti', 'meal', 'anoth', 'would', 'offer', 'glass', 'food', 'wine', 'entir']",service
The takeout is great too since they give high quality tupperware as well.,"['sinc', 'qualiti', 'high', 'give', 'well', 'takeout', 'tupperwar', 'great']","['sinc', 'qualiti', 'high', 'give', 'well', 'takeout', 'tupperwar', 'great']",service
"The food was not fresh, the sauces were bland and very oily.","['fresh', 'oili', 'sauc', 'food', 'bland']","['fresh', 'oili', 'sauc', 'food', 'bland']",food
"Off the beaten path, this jewel of a restaurant shines just one block away from the plethora of 6th street Indian restaurants.","['restaur', 'beat', 'jewel', 'path', 'plethora', 'away', 'th', 'one', 'block', 'indian', 'shin', 'street']","['restaur', 'beat', 'jewel', 'path', 'plethora', 'away', 'th', 'one', 'block', 'indian', 'shin', 'street']",anecdotes/miscellaneous
Could be pricey without a prix fixe meal.,"['without', 'could', 'meal', 'pricey', 'fix', 'prix']","['without', 'could', 'meal', 'pricey', 'fix', 'prix']",price
This is definitely an  excellent date spot because of the ambiance and on the weekends the  night scene is more than alive.,"['ambianc', 'date', 'excel', 'night', 'weekend', 'aliv', 'scene', 'definit', 'spot']","['ambianc', 'date', 'excel', 'night', 'weekend', 'aliv', 'scene', 'definit', 'spot']",ambience
I would defiantly come back here again as one of my top choices.,"['come', 'back', 'defiantli', 'choic', 'one', 'top', 'would']","['come', 'back', 'defiantli', 'choic', 'one', 'top', 'would']",anecdotes/miscellaneous
One of us actually liked the expresso - that's it.,"['like', 'actual', 'one', 'us', 'expresso']","['like', 'actual', 'one', 'us', 'expresso']",food
Everyone was more then happy with his choices.,"['happi', 'everyon', 'choic']","['happi', 'everyon', 'choic']",service
"Again, the waitress was awesome.","['waitress', 'awesom']","['waitress', 'awesom']",service
Worth the trip from Manhattan.,"['worth', 'trip', 'manhattan']","['worth', 'trip', 'manhattan']",anecdotes/miscellaneous
I loved everythig about it-especially the shows and actors.,"['everythig', 'show', 'especi', 'love', 'actor']","['everythig', 'show', 'especi', 'love', 'actor']",anecdotes/miscellaneous
The service was fast and friendly and the food was very tasty and they had the best hot sauce to add to your meals.,"['hot', 'best', 'meal', 'fast', 'servic', 'sauc', 'friendli', 'food', 'add', 'tasti']","['hot', 'best', 'meal', 'fast', 'servic', 'sauc', 'friendli', 'food', 'add', 'tasti']",food
"The food was just OK, I would never go back.","['back', 'go', 'would', 'never', 'food', 'ok']","['back', 'go', 'would', 'never', 'food', 'ok']",food
Zero ambiance to boot.,"['zero', 'boot', 'ambianc']","['zero', 'boot', 'ambianc']",ambience
Got a little loud after 8pm when the joint got full.,"['get', 'pm', 'loud', 'full', 'littl', 'joint']","['get', 'pm', 'loud', 'full', 'littl', 'joint']",ambience
Scalina Fedeli reminded me why service is so integral to fine dining.,"['scalina', 'remind', 'fine', 'servic', 'integr', 'din', 'fede']","['scalina', 'remind', 'fine', 'servic', 'integr', 'din', 'fede']",service
i recommend the thai popcorn :),"['thai', 'popcorn', 'recommend']","['thai', 'popcorn', 'recommend']",food
I can't wait for the nex time.,"['time', 'nex', 'wait']","['time', 'nex', 'wait']",anecdotes/miscellaneous
"Everything looks great, the drinks, the decor, the food, even the people.","['decor', 'peopl', 'even', 'everyth', 'drink', 'look', 'food', 'great']","['decor', 'peopl', 'even', 'everyth', 'drink', 'look', 'food', 'great']",food
As soon as my father lifted his pen from the check a chef appeared to usher us out.,"['chef', 'pen', 'soon', 'check', 'us', 'father', 'lift', 'usher', 'appear']","['chef', 'pen', 'soon', 'check', 'us', 'father', 'lift', 'usher', 'appear']",service
The parathas and kebabs are made when ordered ensuring a level of freshness that is unsurpassed.,"['fresh', 'order', 'paratha', 'kebab', 'make', 'ensur', 'unsurpass', 'level']","['fresh', 'order', 'paratha', 'kebab', 'make', 'ensur', 'unsurpass', 'level']",food
Great neighborhood joint.,"['joint', 'neighborhood', 'great']","['joint', 'neighborhood', 'great']",anecdotes/miscellaneous
The tuna and wasabe potatoes are excellent.,"['potato', 'excel', 'tuna', 'wasab']","['potato', 'excel', 'tuna', 'wasab']",food
The only disappointment was the coat check girls who didn't seem to know what a customer is on a realtively non-busy night (for the coat check girls).,"['disappoint', 'busi', 'custom', 'know', 'check', 'night', 'seem', 'non', 'girl', 'coat', 'realtiv']","['disappoint', 'busi', 'custom', 'know', 'check', 'night', 'seem', 'non', 'girl', 'coat', 'realtiv']",service
My fiance took me to Scopa last week for my birthday and I couldn't believe the food.,"['week', 'last', 'scopa', 'take', 'birthday', 'believ', 'food', 'fianc']","['week', 'last', 'scopa', 'take', 'birthday', 'believ', 'food', 'fianc']",anecdotes/miscellaneous
Ummm...the beer was cold.,"['beer', 'cold', 'ummm']","['beer', 'cold', 'ummm']",food
I take all my NYC guests to VT's.,"['vt', 'take', 'nyc', 'guest']","['vt', 'take', 'nyc', 'guest']",anecdotes/miscellaneous
"It is sometimes a little cramped, and can get a little warm, but hello, it's NYC!","['get', 'cramp', 'littl', 'sometim', 'nyc', 'warm', 'hello']","['get', 'cramp', 'littl', 'sometim', 'nyc', 'warm', 'hello']",ambience
"We had great desserts (including the best cannoli I've ever had) and then they offered an after dinner drink, on the house.","['cannoli', 'includ', 'best', 'ever', 'hous', 'dessert', 'dinner', 'offer', 'drink', 'great']","['cannoli', 'includ', 'best', 'ever', 'hous', 'dessert', 'dinner', 'offer', 'drink', 'great']",food
"Good crowd, good outdoor seating, with a hip japanese vibe.","['seat', 'crowd', 'outdoor', 'vibe', 'japanes', 'good', 'hip']","['seat', 'crowd', 'outdoor', 'vibe', 'japanes', 'good', 'hip']",ambience
"Even with the prix fixe pricing, this restaurant is not worth it.","['restaur', 'even', 'fix', 'worth', 'price', 'prix']","['restaur', 'even', 'fix', 'worth', 'price', 'prix']",anecdotes/miscellaneous
"We asked to be moved (which took half an hour), and then were seated in a high traffic area in the back, even though the rest of the room was practically empty.","['move', 'back', 'half', 'seat', 'high', 'area', 'though', 'empti', 'practic', 'hour', 'even', 'take', 'rest', 'room', 'traffic', 'ask']","['move', 'back', 'half', 'seat', 'high', 'area', 'though', 'empti', 'practic', 'hour', 'even', 'take', 'rest', 'room', 'traffic', 'ask']",service
"Good to find a restaurant where the owners have some imagination and they have actually pulled it off, like in this case.","['find', 'pull', 'like', 'restaur', 'actual', 'owner', 'case', 'imagin', 'good']","['find', 'pull', 'like', 'restaur', 'actual', 'owner', 'case', 'imagin', 'good']",anecdotes/miscellaneous
"However, their popularity has yet to slow down, and I still find myself drawn to their ambiance and delectable reputation.","['find', 'draw', 'ambianc', 'yet', 'delect', 'slow', 'reput', 'howev', 'still', 'popular']","['find', 'draw', 'ambianc', 'yet', 'delect', 'slow', 'reput', 'howev', 'still', 'popular']",anecdotes/miscellaneous
"Where tanks in other Chinatown restaurants display a lurking myriad of sad-looking marine life in their murky waters, the tanks at Ping's are clear as glass with healthy-looking creatures who do not yet know that they will be part of some dim sum lover's brunch.","['marin', 'part', 'restaur', 'ping', 'life', 'tank', 'clear', 'myriad', 'yet', 'healthi', 'chinatown', 'water', 'creatur', 'brunch', 'lover', 'display', 'lurk', 'murki', 'sum', 'sad', 'know', 'look', 'glass', 'dim']","['marin', 'part', 'restaur', 'ping', 'life', 'tank', 'clear', 'myriad', 'yet', 'healthi', 'chinatown', 'water', 'creatur', 'brunch', 'lover', 'display', 'lurk', 'murki', 'sum', 'sad', 'know', 'look', 'glass', 'dim']",food
"The Halibut was too salty, dessert was so so (don't waste any of your calories) and service was poor.","['halibut', 'poor', 'dessert', 'servic', 'wast', 'calori', 'salti']","['halibut', 'poor', 'dessert', 'servic', 'wast', 'calori', 'salti']",food
"The view is spectacular, and the food is great.","['spectacular', 'food', 'view', 'great']","['spectacular', 'food', 'view', 'great']",food
"The place wasn't too hard to find, but it was kind of packed, as soon as my boyfriend and I got our food, the line reached the door.","['find', 'get', 'soon', 'food', 'boyfriend', 'reach', 'door', 'hard', 'line', 'kind', 'place', 'pack']","['find', 'get', 'soon', 'food', 'boyfriend', 'reach', 'door', 'hard', 'line', 'kind', 'place', 'pack']",anecdotes/miscellaneous
Good bagels and good cream cheese.,"['chees', 'good', 'bagel', 'cream']","['chees', 'good', 'bagel', 'cream']",food
"The food is wonderful, tasty and filling, and the service is professional and friendly.","['profession', 'wonder', 'servic', 'fill', 'friendli', 'food', 'tasti']","['profession', 'wonder', 'servic', 'fill', 'friendli', 'food', 'tasti']",food
It is also extremely well priced.,"['extrem', 'price', 'well', 'also']","['extrem', 'price', 'well', 'also']",price
Always great service!,"['servic', 'alway', 'great']","['servic', 'alway', 'great']",service
I am happy i did the food was awsome.,"['awsom', 'happi', 'food']","['awsom', 'happi', 'food']",food
I have been in many restaurants all over the city and Roth's Steakhouse has quickly become one of my favorites.,"['restaur', 'steakhous', 'one', 'quickli', 'favorit', 'roth', 'mani', 'citi', 'becom']","['restaur', 'steakhous', 'one', 'quickli', 'favorit', 'roth', 'mani', 'citi', 'becom']",anecdotes/miscellaneous
"We ordered the chicken casserole, but what we got were a few small pieces of chicken, all dark meat and on the bone.","['bone', 'small', 'get', 'dark', 'order', 'chicken', 'piec', 'casserol', 'meat']","['bone', 'small', 'get', 'dark', 'order', 'chicken', 'piec', 'casserol', 'meat']",food
A bit breezy up there on the mezzanine from the wind coming from the tracks.,"['wind', 'mezzanin', 'come', 'track', 'breezi', 'bite']","['wind', 'mezzanin', 'come', 'track', 'breezi', 'bite']",anecdotes/miscellaneous
I went to DF for Valentines Day dinner.,"['valentin', 'dinner', 'day', 'df', 'go']","['valentin', 'dinner', 'day', 'df', 'go']",anecdotes/miscellaneous
"I recommend the jelly fish, drunken chicken and the soupy dumplings, certainly the stir fry blue crab.","['stir', 'certainli', 'fish', 'chicken', 'fri', 'soupi', 'crab', 'jelli', 'recommend', 'dumpl', 'drunken', 'blue']","['stir', 'certainli', 'fish', 'chicken', 'fri', 'soupi', 'crab', 'jelli', 'recommend', 'dumpl', 'drunken', 'blue']",food
I LOVED THE SHOWS.,"['love', 'show']","['love', 'show']",anecdotes/miscellaneous
"and i have been around the block, to say the very least.","['block', 'least', 'say', 'around']","['block', 'least', 'say', 'around']",anecdotes/miscellaneous
We could have made a meal of the yummy dumplings from the dumpling menu.,"['could', 'dumpl', 'meal', 'make', 'menu', 'yummi']","['could', 'dumpl', 'meal', 'make', 'menu', 'yummi']",food
The aesthetics of this place are like an airport lounge.,"['like', 'airport', 'loung', 'place', 'aesthet']","['like', 'airport', 'loung', 'place', 'aesthet']",ambience
"Then, get ripped on free box wine.","['rip', 'box', 'get', 'free', 'wine']","['rip', 'box', 'get', 'free', 'wine']",food
My wife and I ate here earlier this week and have not stopped ranting and raving about the food.,"['food', 'stop', 'week', 'rant', 'rave', 'eat', 'earlier', 'wife']","['food', 'stop', 'week', 'rant', 'rave', 'eat', 'earlier', 'wife']",food
"If you don't mind pre-sliced low quality fish, unfriendly staff and a sushi chef that looks like he is miserable then this is your place.","['slice', 'chef', 'like', 'mind', 'qualiti', 'unfriendli', 'fish', 'sushi', 'staff', 'pre', 'miser', 'low', 'look', 'place']","['slice', 'chef', 'like', 'mind', 'qualiti', 'unfriendli', 'fish', 'sushi', 'staff', 'pre', 'miser', 'low', 'look', 'place']",food
The food itself was just ok - nothing spectacular - but the service was awful.,"['aw', 'noth', 'servic', 'spectacular', 'food', 'ok']","['aw', 'noth', 'servic', 'spectacular', 'food', 'ok']",food
The pizza is yummy and I like the atmoshpere.,"['yummi', 'pizza', 'like', 'atmoshper']","['yummi', 'pizza', 'like', 'atmoshper']",food
"As there were so many to choose from we wandered up and down the street looking in the windows and such noticicing many empty seats ,except at Taj Mahal.","['look', 'mahal', 'seat', 'choos', 'taj', 'wander', 'empti', 'except', 'mani', 'street', 'window', 'notic']","['look', 'mahal', 'seat', 'choos', 'taj', 'wander', 'empti', 'except', 'mani', 'street', 'window', 'notic']",anecdotes/miscellaneous
"Also, don't plan on asking for your favorite roll, if it's not on the menu, you can't have it.","['also', 'favorit', 'menu', 'plan', 'roll', 'ask']","['also', 'favorit', 'menu', 'plan', 'roll', 'ask']",food
Give it a try and enjoy.,"['tri', 'give', 'enjoy']","['tri', 'give', 'enjoy']",anecdotes/miscellaneous
Good food.,"['food', 'good']","['food', 'good']",food
...and that's saying a lot.,"['lot', 'say']","['lot', 'say']",anecdotes/miscellaneous
"those rolls were big, but not good and sashimi wasn't fresh.","['fresh', 'sashimi', 'good', 'big', 'roll']","['fresh', 'sashimi', 'good', 'big', 'roll']",food
"The pesto pizza was excellent, thin-crust pizza with a nice amount of spicy Italian cheese that I'd never heard of before.","['spici', 'hear', 'excel', 'nice', 'chees', 'crust', 'thin', 'amount', 'never', 'pesto', 'pizza', 'italian']","['spici', 'hear', 'excel', 'nice', 'chees', 'crust', 'thin', 'amount', 'never', 'pesto', 'pizza', 'italian']",food
The only thing I could get attention from was one of at least two cats running around that kept batting at my table.,"['tabl', 'get', 'keep', 'could', 'bat', 'two', 'one', 'least', 'run', 'attent', 'around', 'cat', 'thing']","['tabl', 'get', 'keep', 'could', 'bat', 'two', 'one', 'least', 'run', 'attent', 'around', 'cat', 'thing']",anecdotes/miscellaneous
if your into thai..you cannot miss this great restaurant.,"['restaur', 'miss', 'thai', 'cannot', 'great']","['restaur', 'miss', 'thai', 'cannot', 'great']",anecdotes/miscellaneous
"Going to Ballato's is like coming home and eating in my own kitchen, an absolute delight!","['come', 'delight', 'like', 'absolut', 'ballato', 'eat', 'home', 'kitchen', 'go']","['come', 'delight', 'like', 'absolut', 'ballato', 'eat', 'home', 'kitchen', 'go']",anecdotes/miscellaneous
"try the spicy shrimp appetizer (again, not the greatest value in the world but worth the price) and the lamb vindaloo is great.","['world', 'spici', 'shrimp', 'lamb', 'appet', 'valu', 'greatest', 'tri', 'worth', 'price', 'vindaloo', 'great']","['world', 'spici', 'shrimp', 'lamb', 'appet', 'valu', 'greatest', 'tri', 'worth', 'price', 'vindaloo', 'great']",food
"However, go for the ambience, and consider the food just a companion for a trip across the world!","['world', 'companion', 'trip', 'consid', 'across', 'go', 'howev', 'food', 'ambienc']","['world', 'companion', 'trip', 'consid', 'across', 'go', 'howev', 'food', 'ambienc']",ambience
I think this is one of the more underrated places in the city.,"['think', 'underr', 'one', 'citi', 'place']","['think', 'underr', 'one', 'citi', 'place']",anecdotes/miscellaneous
for out-of-towners who will get a big thrill out of the location!,"['get', 'locat', 'towner', 'big', 'thrill']","['get', 'locat', 'towner', 'big', 'thrill']",anecdotes/miscellaneous
Everyone that has ever come here with me has become a convert and returned regularly with their own friends.,"['come', 'ever', 'friend', 'convert', 'regularli', 'return', 'everyon', 'becom']","['come', 'ever', 'friend', 'convert', 'regularli', 'return', 'everyon', 'becom']",anecdotes/miscellaneous
Food was good not great not worth the wait or another visit,"['visit', 'anoth', 'wait', 'good', 'worth', 'food', 'great']","['visit', 'anoth', 'wait', 'good', 'worth', 'food', 'great']",food
I go at least 3 times a month and have never been disappointed.,"['time', 'month', 'disappoint', 'least', 'never', 'go']","['time', 'month', 'disappoint', 'least', 'never', 'go']",anecdotes/miscellaneous
"Obviously the Chinese translation of this place does not mean Big Wong, it actually means Great Prosperity.","['actual', 'place', 'obvious', 'mean', 'translat', 'prosper', 'big', 'chines', 'wong', 'great']","['actual', 'place', 'obvious', 'mean', 'translat', 'prosper', 'big', 'chines', 'wong', 'great']",anecdotes/miscellaneous
I think the restaurant was too loud (when full) to be romantic.,"['restaur', 'think', 'loud', 'full', 'romant']","['restaur', 'think', 'loud', 'full', 'romant']",ambience
"I have had so many dinners here and it's always been perfect - on a date with my husband, with my mom, with girlfriends and larger groups.","['larger', 'date', 'husband', 'perfect', 'dinner', 'alway', 'group', 'mani', 'girlfriend', 'mom']","['larger', 'date', 'husband', 'perfect', 'dinner', 'alway', 'group', 'mani', 'girlfriend', 'mom']",anecdotes/miscellaneous
"When you want a piece of beef, head on over.","['piec', 'want', 'beef', 'head']","['piec', 'want', 'beef', 'head']",food
"Delicate spices, onions, eggs and a kick-ass roti.","['onion', 'spice', 'ass', 'roti', 'delic', 'kick', 'egg']","['onion', 'spice', 'ass', 'roti', 'delic', 'kick', 'egg']",food
Incredible food at a very agreable price brings me back just about every other day to this authentic Thai restaurant.,"['back', 'restaur', 'authent', 'agreabl', 'everi', 'bring', 'incred', 'day', 'thai', 'food', 'price']","['back', 'restaur', 'authent', 'agreabl', 'everi', 'bring', 'incred', 'day', 'thai', 'food', 'price']",food
"I actually gave Patroon another chance before writing this, but the second visit was even worse.","['write', 'actual', 'chanc', 'visit', 'anoth', 'patroon', 'give', 'even', 'second', 'wors']","['write', 'actual', 'chanc', 'visit', 'anoth', 'patroon', 'give', 'even', 'second', 'wors']",anecdotes/miscellaneous
"Also, if you don't want to sit at a certain table, you don't have to!","['tabl', 'certain', 'also', 'want', 'sit']","['tabl', 'certain', 'also', 'want', 'sit']",anecdotes/miscellaneous
Unbelievable.,['unbeliev'],['unbeliev'],anecdotes/miscellaneous
A little pricey but it really hits the spot on a Sunday morning!,"['morn', 'hit', 'littl', 'sunday', 'realli', 'pricey', 'spot']","['morn', 'hit', 'littl', 'sunday', 'realli', 'pricey', 'spot']",price
I've been living in the Columbia University area for about 10 years with 3 kids - now in their teens.,"['year', 'columbia', 'area', 'teen', 'live', 'univers', 'kid']","['year', 'columbia', 'area', 'teen', 'live', 'univers', 'kid']",anecdotes/miscellaneous
The menu has lots of options: I hope to go back to try those potato pancakes.,"['back', 'potato', 'menu', 'lot', 'option', 'tri', 'hope', 'go', 'pancak']","['back', 'potato', 'menu', 'lot', 'option', 'tri', 'hope', 'go', 'pancak']",food
As soon as I wake up on a saturday or sunday it is the first thing on my mind is when and how I will be getting to fried dumpling.,"['get', 'soon', 'mind', 'first', 'fri', 'dumpl', 'sunday', 'saturday', 'wake', 'thing']","['get', 'soon', 'mind', 'first', 'fri', 'dumpl', 'sunday', 'saturday', 'wake', 'thing']",anecdotes/miscellaneous
"The staff isn't the friendliest or most competent, and I am stickler for service, but everything else about this place makes up for it.","['els', 'staff', 'make', 'servic', 'friendliest', 'everyth', 'stickler', 'place', 'compet']","['els', 'staff', 'make', 'servic', 'friendliest', 'everyth', 'stickler', 'place', 'compet']",service
"My wife and I will usually only order one primi and one secondi and split them, as they tend to offer large portions.","['usual', 'secondi', 'tend', 'order', 'primi', 'one', 'split', 'offer', 'larg', 'portion', 'wife']","['usual', 'secondi', 'tend', 'order', 'primi', 'one', 'split', 'offer', 'larg', 'portion', 'wife']",anecdotes/miscellaneous
This restaurant was way overhyped.,"['overhyp', 'restaur', 'way']","['overhyp', 'restaur', 'way']",anecdotes/miscellaneous
I've overheard comments from him to his employees that should not have been delivered in the dining area and I've been sitting there while he lectured another customer.,"['lectur', 'custom', 'area', 'employe', 'deliv', 'anoth', 'comment', 'overhear', 'din', 'sit']","['lectur', 'custom', 'area', 'employe', 'deliv', 'anoth', 'comment', 'overhear', 'din', 'sit']",service
Delicious crab cakes too.,"['delici', 'cake', 'crab']","['delici', 'cake', 'crab']",food
"Now at the top of our list, Del Frisco's Steakhouse.","['list', 'del', 'frisco', 'top', 'steakhous']","['list', 'del', 'frisco', 'top', 'steakhous']",anecdotes/miscellaneous
I cannot imagine you not rushing out to eat there.,"['imagin', 'rush', 'cannot', 'eat']","['imagin', 'rush', 'cannot', 'eat']",anecdotes/miscellaneous
This was the worst dining experience I've ever had.,"['ever', 'experi', 'worst', 'din']","['ever', 'experi', 'worst', 'din']",anecdotes/miscellaneous
I have been coming here for years and have nothing but good things to say about the service and the great staff at La Lanterna.,"['come', 'lanterna', 'la', 'year', 'noth', 'staff', 'servic', 'say', 'good', 'thing', 'great']","['come', 'lanterna', 'la', 'year', 'noth', 'staff', 'servic', 'say', 'good', 'thing', 'great']",service
Just bring someone who speaks Cantonese because waiter may not understand you.,"['waiter', 'may', 'bring', 'speak', 'someon', 'cantones', 'understand']","['waiter', 'may', 'bring', 'speak', 'someon', 'cantones', 'understand']",service
I thought I had died and gone to heaven.,"['go', 'die', 'heaven', 'think']","['go', 'die', 'heaven', 'think']",anecdotes/miscellaneous
"Not someplace I would seek to try out but if I am in the area again, I will certainly stop by.","['certainli', 'someplac', 'stop', 'area', 'would', 'seek', 'tri']","['certainli', 'someplac', 'stop', 'area', 'would', 'seek', 'tri']",anecdotes/miscellaneous
The bruschetta and panini's are so yummy!,"['bruschetta', 'panini', 'yummi']","['bruschetta', 'panini', 'yummi']",food
"Food was okay, nothing great.","['okay', 'noth', 'food', 'great']","['okay', 'noth', 'food', 'great']",food
Every waitress and customer who passed by me bumped into my chair.,"['custom', 'everi', 'bump', 'pass', 'chair', 'waitress']","['custom', 'everi', 'bump', 'pass', 'chair', 'waitress']",anecdotes/miscellaneous
I have been going there since it opened and I can't get enough.,"['get', 'sinc', 'enough', 'go', 'open']","['get', 'sinc', 'enough', 'go', 'open']",anecdotes/miscellaneous
"Always popular, always full, always a wait.","['wait', 'alway', 'popular', 'full']","['wait', 'alway', 'popular', 'full']",ambience
"In fact, you can't miss it.","['miss', 'fact']","['miss', 'fact']",anecdotes/miscellaneous
I recently tried Suan and I thought that it was great.,"['suan', 'think', 'recent', 'tri', 'great']","['suan', 'think', 'recent', 'tri', 'great']",anecdotes/miscellaneous
A little noise but I think that was because of our party!,"['littl', 'nois', 'parti', 'think']","['littl', 'nois', 'parti', 'think']",ambience
It is run by the same Sichuan chef who started the chain in Chinatown.,"['chef', 'sichuan', 'start', 'run', 'chinatown', 'chain']","['chef', 'sichuan', 'start', 'run', 'chinatown', 'chain']",anecdotes/miscellaneous
